Encrypted_Text,Cipher_Type
XGPDQANMILFBMXKCMZIWKYPDFKOTAPLILT,Playfair
"W r adgtrssihSoe.Ihu rg' hi ost,tns eudePe",Rail Fence
"Owzr Uvapcu. W riec xpemm'x zrcwp Fauuczu,",Affine
"Wkdw Ghdwk dqg Qdwxuh grh frqwhqg derxw wkhp,",Caesar
"Jxkp Haqdd kjt Dqdqho tya mkddadn qlkkd jrac,",Vigenère
PDRSCKRSBORYARLZMKHRLENALKRYBIMVSZPDLC,Playfair
"T tnaeendot,htDahadNtr o otn bu hmae  udceate",Rail Fence
"Zriz Xcizr ivx Vizepc xac savzcvx inaez zrcq,",Affine
"Zkhwkhu wkhb olxh, ru gbh.",Caesar
"Mxopxon ddui bsqu, eb tia.",Vigenère
VYKLCFDZCFCQEXFMDKCG,Playfair
"Wht erehte hylu,o y.erei d",Rail Fence
"Orczrcp zrcy lwec, ap xyc.",Affine
Hqwhu Pdfehwk.,Caesar
Uddah Cqmxudd.,Vigenère
GMLKMOMBCIPD,Playfair
Erchne abt.tMe,Rail Fence
Cvzcp Qisnczr.,Affine
Pdfe. Zkr'v wkhuh? zkdw krd?,Caesar
Cqmx. Mxy'i pxonu? mrwj dek?,Vigenère
ORHDVYAPPDKMGUBOPDNR,Playfair
M.otehhab h' hr?wa o?cWse ta,Rail Fence
Qisn. Ora'u zrcpc? oriz rai?,Affine
"Odgb. Dodfn, L dp diudlg wkhb kdxh dzdn'g,",Caesar
"Bqnu. Qbkya, S wc wvbwyn jrao dqea ksqu't,",Vigenère
SMCBMSMBEKROOIMRKBPDGCBOMLNXRIBZ,Playfair
"L.a mr yuwday lc,Ia fadte aeaa',dAk aihh k",Rail Fence
"Lixy. Ilisg, W iq ihpiwx zrcy riec ioig'x,",Affine
"Dqg 'wlv qrw grqh: wk' dwwhpsw, dqg qrw wkh ghhg,",Caesar
"Qdn 'dei jed tyju: jr' kpjoifd, kjt jed jra naun,",Vigenère
RAKZSXANZKNAKLBOSZLKOLSRRYANSZPDKCIUKC,Playfair
"A'  ehtpantd,n tsntdn:t'atmt n o h eddioo  e,dtee",Rail Fence
"Ivx 'zwu vaz xavc: zr' izzcqfz, ivx vaz zrc xccx,",Affine
"Frqirxqgv yv: khdunh: L odb'g wkhlu Gdjjhuv uhdgb,",Caesar
"Sexbeejtc lc: raqbgu: S hqi't pxoeh Tqqcubo baqnu,",Vigenère
HMOGMVRYPXPBIMDTFKSMBCPDFKDKNIIFATMKRBBW,Playfair
"Cos:a:ldeDeryofud s ere  a' hi agr ed,nnvhkIytrgsa",Rail Fence
"Savhaevxu ju: rcipgc: W liy'x zrcwp Ximmcpu pcixy,",Affine
Kh frxog qrw plvvh 'hp. Kdg kh qrw uhvhpeohg,Caesar
Xu yeeht jed csoio 'oi. Xqn xo dyp baioirvat,Vigenère
CFHMMUYRRPAEXALILCBOCYGMRPMKLIACULBZ,Playfair
Ho  seHhoebecudntmse'm a entrsmld loi .d  ee,Rail Fence
Rc saelx vaz qwuuc 'cq. Rix rc vaz pcucqnlcx,Affine
"Pb Idwkhu dv kh vohsw, L kdg grq'w.",Caesar
"Co Vqddub qc xo ivafd, M xkz nkd'p.",Vigenère
NCIOPDKMBXCFTPFLSKBOBZHRRQ,Playfair
"Mar st  'yFte sh lp,Ihddnt haee ao.",Rail Fence
"Qy Hizrcp iu rc ulcfz, W rix xav'z.",Affine
Pb Kxvedqg?,Caesar
Co Xkcxqxz?,Vigenère
NCCVXIRABZ,Playfair
MunyHsad b?,Rail Fence
Qy Reunivx?,Affine
Pdfe. L kdxh grqh wkh ghhg:,Caesar
Cqmx. Y rwko tyju pxo toat:,Vigenère
ORHDFBMXKCNAKLCFCKKC,Playfair
M.h eeeab  aedn h edcIuotd:,Rail Fence
Qisn. W riec xavc zrc xccx:,Affine
Glgvw wkrx qrw khduh d qrbvh?,Caesar
Tynoj pxyq xkj duknu w xkoca?,Vigenère
BKBTSZPDMVANPDIMMKRANHLI,Playfair
Dtooe o?is hunthaeanyedt  r s,Rail Fence
Xwxuz zrae vaz rcipc i vayuc?,Affine
"Odgb. L khdug wkh Rzoh vfkuhdph, dqg wkh Fulfnhwv fub.",Caesar
"Bqnu. Y raqbz ddu Emva cyxbaqwa, wdn jra Gnymgudo mno.",Vigenère
SMCBFBIMDKPDFMUQILHYMKROIMRYPDLEAKDEKLLBND,Playfair
"L.hdelca   csyay  er h weshem,adteCikt r.dIatO renhrec",Rail Fence
"Lixy. W rcipx zrc Aolc usrpciqc, ivx zrc Spwsgczu spy.",Affine
Glg qrw brx vshdnh?,Caesar
Tyn dyp ikk ofowao?,Vigenère
BKYRRPHNXLLFRIIU,Playfair
Dnyski o o paedtue?,Rail Fence
Xwx vaz yae ufcigc?,Affine
Pdfe. Zkhq?,Caesar
Cqmx. Mxoj?,Vigenère
ORHDVYGM,Playfair
M.eab hncW?,Rail Fence
Qisn. Orcv?,Affine
Odgb. Qrz,Caesar
Bqnu. Deg,Vigenère
SMCBANXZ,Playfair
L.way odN,Rail Fence
Lixy. Vao,Affine
Pdfe. Dv L ghvfhqghg?,Caesar
Cqmx. Qi Y naimadnat?,Vigenère
ORHDBXKBILELRYKC,Playfair
M. en?ab sIdseddcA ce,Rail Fence
Qisn. Iu W xcuscvxcx?,Affine
Odgb. L,Caesar
Bqnu. Y,Vigenère
SMCBSA,Playfair
L.ay dI,Rail Fence
Lixy. W,Affine
"Pdfe. Khdunh, zkr obhv l'wk' vhfrqg Fkdpehu?",Caesar
"Cqmx. Xuknao, gde hooo s'jr' casyjt Sxkiron?",Vigenère
ORHDCFRMEFVYMPCGXSPDLIHMRYHYROCIAZ,Playfair
"M.a,oe' oCbab ere h ysit'scn hme?cHkwl hedar",Rail Fence
"Qisn. Rcipgc, ora lycu w'zr' ucsavx Sriqncp?",Affine
Odgb. Grqdoedlqh,Caesar
Bqnu. Texwblwyxa,Vigenère
SMCBHRARSCBSMG,Playfair
L.naay oabiedDln,Rail Fence
Lixy. Xavilniwvc,Affine
Pdf. Wklv lv d vruub vljkw,Caesar
Cqm. Xdyc yc q oebno oyqdj,Vigenère
ORDLBFXSXBPAAZNDXSFYSZ,Playfair
M s o ha.Ti sasrysgtchi ri,Rail Fence
Qis. Zrwu wu i uappy uwmrz,Affine
"Odgb. D irrolvk wkrxjkw, wr vdb d vruub vljkw",Caesar
"Bqnu. Q pkeveir jrkkqdj, jy iku k iynhi iscxd",Vigenère
SMCBOIAVMPSXDPFHWEDPPRXBBNPAAZNDXSFYSZ,Playfair
"L.fitg sarstay  ols huh,t a  or ihdAohotoysyg",Rail Fence
"Lixy. I haalwur zraemrz, za uiy i uappy uwmrz",Affine
"Pdfe. Wkhuh'v rqh glg odxjk lq'v vohhsh,",Caesar
"Cqmx. Jxonu'o yju zyn bkqwr yx'i oboafo,",Vigenère
ORHDPDKMILNAKCKBSMWEBFAQTPIUFLIU,Playfair
"M.esedui eab hr' n i ag nssep,cTeodlh'le",Rail Fence
"Qisn. Zrcpc'u avc xwx liemr wv'u ulccfc,",Affine
"Dqg rqh fub'g Pxuwkhu, wkdw wkhb glg zdnh hdfk rwkhu:",Caesar
"Qdn exa mno'z Qqhddub, ddqd jrao zyn mkgu aqmd ypxon:",Vigenère
RAHRMGDMBCCMDZCFDZBOSZPDGCBKYZRIIUIMHYRPCFAZ,Playfair
"Aocdrrht  ect:n n r' ute,ta hyddwk ahohrdeyMh teiae e",Rail Fence
"Ivx avc spy'x Qepzrcp, zriz zrcy xwx oigc cisr azrcp:",Affine
"L vwrrg, dqg khdug wkhp: Exw wkhb glg vdb wkhlu Sudbhuv,",Caesar
"Y cpeyz, wdn xowhn jrac: Lep ddui tsz cwo pxoeh Fhkuubo,",Vigenère
SXPRRHRACYIMDKPDLCCXSZPDGCBKBTNBPDFKOTMRCGAT,Playfair
"Io  rh  ydyePe to,adhadte:Btte i a hi ryr,sdne muhdstras",Rail Fence
"W uzaax, ivx rcipx zrcq: Nez zrcy xwx uiy zrcwp Fpiycpu,",Affine
Dqg dgguhvw wkhp djdlqh wr vohhsh,Caesar
Qdn qnzhooj pxoi kcqsju pe oboafo,Vigenère
RABRBZKDILSZPDLCNIBSMGPRTPIUFLIU,Playfair
Aaet itlen drs hmaan osepddtege e,Rail Fence
Ivx ixxpcuz zrcq imiwvc za ulccfc,Affine
Odgb. Wkhuh duh wzr orgj'g wrjhwkhu,Caesar
Bqnu. Jxonu who jgk vktq't peqajrah,Vigenère
SMCBPDKMIMMKQZMPRHKYPRIFPDKM,Playfair
L.eatl'ohay hr r w ogdtgtedTeeod er,Rail Fence
Lixy. Zrcpc ipc zoa laxm'x zamczrcp,Affine
"Pdfe. Rqh fub'g Jrg eohvvh yv, dqg Dphq wkh rwkhu,",Caesar
"Cqmx. Edo sbu'n Qyz lhucou ri, qxz Eiux jra ypxon,",Vigenère
ORHDNALENDYKRHCSILLIXPRABRCLRQCFRPCFAZ,Playfair
"M.eyGbssnmtorab n r' o lsev,adAe h te,cOcdde   neh",Rail Fence
"Qisn. Avc spy'x Max nlcuuc ju, ivx Iqcv zrc azrcp,",Affine
Dv wkhb kdg vhhqh ph zlwk wkhvh Kdqjpdqv kdqgv:,Caesar
Qi pxou rwt ouoju iu sydd dduca Lwdqiqxo rwdno:,Vigenère
BXPDGCBOBTIUGMLCGUKSDPCFLIBOYQORAQBORYXA,Playfair
Ahhse heHm dste a en ewt hs agashns ydemitenna:,Rail Fence
Iu zrcy rix uccvc qc owzr zrcuc Rivmqivu rivxu:,Affine
"Olvwqlqj wkhlu ihduh, L frxog qrw vdb Dphq,",Caesar
"Bycpdsjw pxoeh buknu, S yeeht jed iku Eiux,",Vigenère
SETLAGYQPDFKOKIMMKEBMVTCANLTNBROGM,Playfair
"Ln ie,cdtyeitigterfae  ol o a mnsnh rIunsA,",Rail Fence
"Lwuzvwvm zrcwp hcipc, W saelx vaz uiy Iqcv,",Affine
Zkhq wkhb glg vdb Jrg eohvvh yv,Caesar
Mxoj ddui tsz cwo Wen rvaica fo,Vigenère
VYGMPDGCBKBTNBFNCDULXALIXP,Playfair
W ydyde hnte i a o lsevehdsGbss,Rail Fence
Orcv zrcy xwx uiy Max nlcuuc ju,Affine
Odgb. Frqvlghu lw qrw vr ghhshob,Caesar
Bqnu. Sexoynah ej jed iy toafoho,Vigenère
SMCBHMAQKBKMKSANLTRHIUFLLUBW,Playfair
L.nett pay osdri o odeeydCi nsel,Rail Fence
Lixy. Savuwxcp wz vaz ua xccfcly,Affine
Pdf. Exw zkhuhiruh frxog qrw L surqrxqfh Dphq?,Caesar
Cqm. Fqj sxonupkho syqbn dyp M fbkdyqdma Eiux?,Vigenère
ORHDZLVYKMFGNMLEMVTCANSKTONAMVMYIMCLAW,Playfair
M  rro  ru na.BtweeoecudntIpooneAe?cuhf lo ncm,Rail Fence
Qis. Nez orcpchapc saelx vaz W fpavaevsc Iqcv?,Affine
"L kdg prvw qhhg ri Eohvvlqj, dqg Dphq vwxfn lq pb wkurdw",Caesar
"Y rwt iecp xaun ep Lvaicedq, kjt Qcoj cpkmg sj wu ddhywj",Vigenère
FBRBONTLMGKCHPCSILXSYQRABRCLAQLZDEGANCPDMNRS,Playfair
"Idseoli  nuiyr a otne fBesn,adAe tc nm hothm d sgnmsk ta",Rail Fence
"W rix qauz vccx ah Nlcuuwvm, ivx Iqcv uzesg wv qy zrpaiz",Affine
Odgb. Wkhvh ghhgv pxvw qrw eh wkrxjkw,Caesar
Bqnu. Jxoou zuozi ikcp xkj xu pxyqwrp,Vigenère
SMCBPDILKCIUKCLAXLQRRPCIPDMVFYSZ,Playfair
L.edssoeotay hs ed utntb huhdTeem  tg,Rail Fence
Lixy. Zrcuc xccxu qeuz vaz nc zraemrz,Affine
"Diwhu wkhvh zdbhv: vr, lw zloo pdnh yv pdg",Caesar
"Qvdah pxoou sqiai: iy, sp gebv ckgu ri iqn",Vigenère
OILKDZCFLIXNCGXAPAKSXGSUUCRIFULARB,Playfair
"Arewsotlavafe hs ae:s,i ilmk smdttey  w e ",Rail Fence
"Ihzcp zrcuc oiycu: ua, wz owll qigc ju qix",Affine
"Pdfe. Ph wkrxjkw L khdug d yrbfh fub, Vohhs qr pruh:",Caesar
"Cqmx. Cu pxyqwrp M xowhn q reiyu yhi, Whuol xk wkho:",Vigenère
ORHDCLPDMVFYSKCFRMBROHBHLENDTPIUFLANONMK,Playfair
"M. u e o ,enoab etogtIhadavyecy le omr:cMhh r crSp e",Rail Fence
"Qisn. Qc zraemrz W rcipx i jaysc spy, Ulccf va qapc:",Affine
"Pdfehwk grhv pxuwkhu Vohhsh, wkh lqqrfhqw Vohhsh,",Caesar
"Cqmxudd nkuc cenjrah Iboafo, ddu edxksojj Iboafo,",Vigenère
ORHDKLYCMFLAZMPDKMTPIUFLKLCFGAANELRQTPIUFLIU,Playfair
"Med t e  ote,abt osmrhrSep,teincn leecheuelehneSp",Rail Fence
"Qisnczr xacu qepzrcp Ulccfc, zrc wvvascvz Ulccfc,",Affine
"Vohhsh wkdw nqlwv ys wkh udxho'g Vohhxh ri Fduh,",Caesar
"Iboafo jrwj gdspi rf pxo hkquv't Iboako ep Mknu,",Vigenère
TPIUFLKLBOZTAGLTOVPDKMMXLUBTULLMFMEHRMIU,Playfair
"Sphks  e eoaleeta nt pteruldSeu fCr,e tivha'le e",Rail Fence
"Ulccfc zriz gvwzu jf zrc piecl'x Ulccec ah Sipc,",Affine
"Wkh ghdwk ri hdfk gdbhv Olih, vruh Oderuv Edwk,",Caesar
"Jxo towjr ep ukyx zqiai Bypa, oeba Pwryni Rqdd,",Vigenère
PDKCIMPDHPIMHYBRCGTPKGILNMLUBINMXIRSBV,Playfair
"Tdh hyL,rasth et fec ae ie oeLbr aheaoadsfs oB,",Rail Fence
"Zrc xcizr ah cisr xiycu Lwhc, uapc Linapu Nizr,",Affine
"Edoph ri kxuw Plqghv, juhdw Qdwxuhv vhfrqg Frxuvh,",Caesar
"Rqviu kv dkbp Qednai, wbaqd Xkpkbai oumkdn Myqhca,",Vigenère
IBUCFMPFZMLRGACKQIMKRSARLZMKXALIHMRYHMZMLI,Playfair
"Be tn,eNrsnoeam fhr ids ra aue eodCus,louMegttsc r",Rail Fence
"Nilqc ah repz Qwvxcu, mpciz Vizepcu ucsavx Saepuc,",Affine
Fklhih qrxulvkhu lq Olih'v Ihdvw,Caesar
Sxsavo dyqhsoxon sj Pevo'i Vukoj,Vigenère
HYKFGFANZMSXCFAKMQKGILGFBXSZ,Playfair
Cfos L'eheenuihri iesFati renf s,Rail Fence
Srwchc vaepwurcp wv Lwhc'u Hciuz,Affine
Odgb. Zkdw grh brx phdqh?,Caesar
Bqnu. Mxkp nku uee cowdo?,Vigenère
SMCBVYRSHRGCMVCLRAIU,Playfair
L.aooe?ay htdeyumaedW   n,Rail Fence
Lixy. Oriz xac yae qcivc?,Affine
"Pdfe. Vwloo lw fub'g, Vohhsh qr pruh wr doo wkh Krxvh:",Caesar
"Cqmx. Ijshb ej yhi't, Cvauza xk wkho jy qvh ddu Xeeou:",Vigenère
ORHDTLESSELDNDBTULFLGMNONMKLNRSUPLCFFHXLIU,Playfair
"M.iir,e m atHeab tl tcyd leen oet l h os:cSl 'Sporoleu",Rail Fence
"Qisn. Uzwll wz spy'x, Ulccfc va qapc za ill zrc Raeuc:",Affine
"Jodplv kdwk pxuwkhu'g Vohhsh, dqg wkhuhiruh Fdzgru",Caesar
"Wbkiyc xkpx ikbpxon'n Cvauza, wdn jrahobeba Gwmnkh",Vigenère
EQROSXBOPDCMDZCFDKTPIUFLIMRYPDKMFGNMLENXHRAZ,Playfair
"Giamhde,deoColmsht ute' lee n hrfr adra hrrSpateew",Rail Fence
"Mliqwu rizr qepzrcp'x Ulccfc, ivx zrcpchapc Sioxap",Affine
Vkdoo vohhsh qr pruh: Pdfehwk vkdoo vohhsh qr pruh,Caesar
Ixkhb oboafo dy cynu: Wkyropx oxkhb oboafo dy cynu,Vigenère
PBMSPTULFLGMNONMLCMBCIPDPBMSPTULFLGMNONMIU,Playfair
Sle m:chasporhl leen oe abt hl leen oeasporMesle m,Rail Fence
Urill ulccfc va qapc: Qisnczr urill ulccfc va qapc,Affine
"Odgb. Zkr zdv lw, wkdw wkxv fub'g? zkb zruwkb Wkdqh,",Caesar
"Bqnu. Mxy mko sp, pxkp ddkc sbu'n? gdo sebpxi Drwdo,",Vigenère
SMCBVYNVBXKSPDRSPDXLDMBCVYGNNMPDDQBOMG,Playfair
"L.os,ahcdhoyaay h a t httu r'?wywrh hn,dWwit sy  tTe",Rail Fence
"Lixy. Ora oiu wz, zriz zreu spy'x? ory oapzry Zrivc,",Affine
"Brx grh yqehqg brxu Qreoh vwuhqjwk, wr wklqnh",Caesar
"Oee tya fjrojt ueen Rkrva cphojwdd, pe pxsjao",Vigenère
HNZCMFWOCIRYHNZMANCSILZDGMKQDPRPBFRGIU,Playfair
"YdvnoNerttheo o nedyu ol tegh otikueb rbsn, n",Rail Fence
"Yae xac jvncvx yaep Vanlc uzpcvmzr, za zrwvgc",Affine
"Vr eudlqh-vlfnob ri wklqjv: Jrh jhw vrph Zdwhu,",Caesar
"Ie xhkedo-isyavu yb ddyxci: Qya qaj oewa Awjon,",Vigenère
PADABSMGXSDEQCHPPDGAIQFNFIKLPACLXNLKAZ,Playfair
"Srec tgGgs eoban-ikyo hns o e oeWtr islfi:etma,",Rail Fence
"Ua npiwvc-uwsgly ah zrwvmu: Mac mcz uaqc Oizcp,",Affine
Dqg zdvk wklv ilowklh Zlwqhvvh iurp brxu Kdqg.,Caesar
Qdn mkox pxso pebddyo Gspdooio vbkc ueen Lwdn.,Vigenère
RAYZBXDPBFPIESPDKFXGQRILLIKONOHNZMBORY,Playfair
Aw sletsry dn ahti iti insefo orHn.dshfhWe mua,Rail Fence
Ivx oiur zrwu hwlzrwc Owzvcuuc hpaq yaep Rivx.,Affine
Zkb glg brx eulqj wkhvh Gdjjhuv iurp wkh sodfh?,Caesar
Mxi tsz ikk xhsjw pxoou Tqqcubo pnew jra zhqma?,Vigenère
VYBCKBHNXCAKYQPDILKCNIIFATKONOPDFLSMEL,Playfair
WdybgeDef  ch i o rn hs agr rmtepaeyduitegsohl?,Rail Fence
Ory xwx yae npwvm zrcuc Ximmcpu hpaq zrc flisc?,Affine
"Wkhb pxvw obh wkhuh: jrh fduub wkhp, dqg vphduh",Caesar
"Jxou wqid bia dduba: ceo sknhi jrac, qxz ciuknu",Vigenère
PDGCCMTLQCKLCFMKFNLERMNDPDLCRABTCLRMIU,Playfair
"T tee  rh  ahyms y hr:gecryte,adsereulteoa mnme",Rail Fence
"Zrcy qeuz lyc zrcpc: mac sippy zrcq, ivx uqcipc",Affine
Wkh vohhslh Jurrphv zlwk eorrg,Caesar
Jxo ivauzeu Whykcoo gejr rvken,Vigenère
PDILULFLKFKNAVNOILXGPDCSAVRH,Playfair
TspGmw oh lei roe ihbodeeeostl,Rail Fence
Zrc ulccfwc Mpaaqcu owzr nlaax,Affine
Pdfe. Loh jrh qr pruh:,Caesar
Cqmx. Ybo wya xk wkho:,Vigenère
ORHDESFIMFANONMK,Playfair
M.ee eab l o omr:cIgno,Rail Fence
Qisn. Wlc mac va qapc:,Affine
"L dp diudlg, wr wklqnh zkdw L kdxh grqh:",Caesar
"Y ki kbhket, jy jredua gdqd S dqea nkdo:",Vigenère
SBORKOBSKZRPBFRGGUBOSKBOMLHRMG,Playfair
"I a tkhIuo mari,t hnewa  aedn:afdoi th e",Rail Fence
"W iq ihpiwx, za zrwvgc oriz W riec xavc:",Affine
"Orrnh rq'w djdlqh, L gduh qrw",Caesar
"Beygu kd'p kcqsju, S zqba xkj",Vigenère
PMRFFMRQNIBSMGKBRMGMRP,Playfair
"Le'ge etok ntaan,Idr ooo i an",Rail Fence
"Laagc av'z imiwvc, W xipc vaz",Affine
Odgb. Lqiluph ri sxusrvh:,Caesar
Bqnu. Ydpehwa yb zqhzkio:,Vigenère
SMCBGAGKMOFMPVZMVHLI,Playfair
L.fe p:ay nim fproedIrous,Rail Fence
Lixy. Wvhwpqc ah fepfauc:,Affine
"Jlxh ph wkh Gdjjhuv: wkh vohhslqj, dqg wkh ghdg,",Caesar
"Wyea wa ddu Tqqcubo: pxo ivauzedq, kjt pxo towt,",Vigenère
IKMLCLPDKCNIIFATPDILULFLGAINRYPDKCIMBZ,Playfair
"G tDe  egnheiem h agr:tesepn,adteda,ueegshli   d",Rail Fence
"Mwec qc zrc Ximmcpu: zrc ulccfwvm, ivx zrc xcix,",Affine
"Duh exw dv Slfwxuhv: 'wlv wkh Hbh ri Fklogkrrg,",Caesar
"Qho rep ko Tesdqhoo: 'jso ddu Uoo ep Mrebndeyz,",Vigenère
RMICZLBXSFDLZMILSKTLCFGCFMEHBFTCFHRH,Playfair
"Abair see lor u sPcue:'i h y fCidodet tsttEohh,",Rail Fence
"Ipc nez iu Fwszepcu: 'zwu zrc Cyc ah Srwlxraax,",Affine
"Wkdw ihduhv d sdlqwhg Ghxloo. Li kh grh eohhg,",Caesar
"Jxkp paqbai w zwyxpun Noqyvh. Yv du zeo rvaun,",Vigenère
PDRSGFRMILOSBSRQKCCKXESUSEPFKCMFCSIUKC,Playfair
"T raidu. dbdhtfae  ane eil fh o le,aesptDlIeee",Rail Fence
"Zriz hcipcu i fiwvzcx Xcewll. Wh rc xac nlccx,",Affine
"Loh jxlog wkh Idfhv ri wkh Jurrphv zlwkdoo,",Caesar
"Ybo weebn jra Jwsoo yb ddu Whykcoo gejrwbv,",Vigenère
ESFIXETCPDFGMBILHPPDFIMNNOILXGPDMSSU,Playfair
"Igdecohreill ul h ae fteGomswtaleitFs  o h,",Rail Fence
"Wlc mewlx zrc Hiscu ah zrc Mpaaqcu owzrill,",Affine
Iru lw pxvw vhhph wkhlu Jxlow.,Caesar
Veb yd ceoj ouoiu pxoeh Wkshj.,Vigenère
PHAKLRXLLTIULCKLCFKAEWESSZ,Playfair
FiuseeGto tms em hi ul.r tetri,Rail Fence
Hap wz qeuz uccqc zrcwp Mewlz.,Affine
Hqwhu.,Caesar
Uddah.,Vigenère
GMLKAZ,Playfair
Erne.t,Rail Fence
Cvzcp.,Affine
Nqrfnh zlwklq.,Caesar
Adyyao mspxsj.,Vigenère
GRMHEFXGPDGA,Playfair
Kkinncewti.o h,Rail Fence
Gvasgc owzrwv.,Affine
Pdfe. Zkhqfh lv wkdw nqrfnlqj?,Caesar
Cqmx. Mxojso yc jrwj gdyyasjw?,Vigenère
ORHDVYGMELSXPDRSGRMHEKYQ,Playfair
M.e t cgab hnei htkokn?cWcsani,Rail Fence
Qisn. Orcvsc wu zriz gvasgwvm?,Affine
"Krz lv'w zlwk ph, zkhq hxhub qrbvh dssdoov ph?",Caesar
"Xeg yc'j sydd wa, sxoj oqubu xkoca klfkhbc co?",Vigenère
FHXGTLXGPDCLVYGMLMKMGYNHLIOSSOSUPTCL,Playfair
"Hi h,eu spleo stwt e hneeynyeaplsm?w'imw ro a ",Rail Fence
"Rao wu'z owzr qc, orcv cecpy vayuc iffillu qc?",Affine
Zkdw Kdqgv duh khuh? kdk: wkhb soxfn rxw plqh Hbhv.,Caesar
Mxkp Lwdno knu duba? dqr: ddui fvqsu eep wedo Oiai.,Vigenère
VYRSBORYXBMKCFMKBODPCFHQUMDEMVLRGAIUGCIL,Playfair
W dre :el  eehtHnsaehr?hh hypukotmn ysaa  eat cuiE.,Rail Fence
Oriz Rivxu ipc rcpc? rir: zrcy flesg aez qwvc Cycu.,Affine
Zloo doo juhdw Qhswxqhv Rfhdq zdvk wklv eorrg,Caesar
Myvh khb chowj Duzpkxai Esowd sqcd ddyc rvken,Vigenère
XGSUSMSUQEMKRSMGQLWMILMHIMYNBXDPBFXIPMRH,Playfair
W  aenOnshbdilalgetNpue ca ahti lollr tsew so,Rail Fence
Owll ill mpciz Vcfzevcu Asciv oiur zrwu nlaax,Affine
Fohdqh iurp pb Kdqg? qr: wklv pb Kdqg zloo udwkhu,Caesar
Sbowdo vbkc io Xqxz? je: jrei io Xqxz gebv hkpxon,Vigenère
EUIMMGKONONCBORYANPDSXNCBORYXGSUTMRSCFAZ,Playfair
Cnrma  s dlarlaefo yHn?n:ti yHn ilrtee m dohmaw h,Rail Fence
Slcivc hpaq qy Rivx? va: zrwu qy Rivx owll pizrcp,Affine
"Wkh pxowlwxglqrxv Vhdv lqfduqduglqh,",Caesar
"Jxo cehjspknedyqi Iuko sjskndkntsju,",Vigenère
PDLCMUSKLZBKANXLLIBXGABMMARMBKMG,Playfair
"Tmiisannih uttdnu esicradn,eluoS are",Rail Fence
"Zrc qelzwzexwvaeu Uciu wvsipvipxwvc,",Affine
"Pdnlqj wkh Juhhqh rqh, Uhg.",Caesar
"Cquedq jra Knuoju kdo, Vat.",Vigenère
OREKYQPDFIMKGMFMMGMKBZ,Playfair
"MnhreeeaigteGen n,Rdk  eo .",Rail Fence
"Qigwvm zrc Mpccvc avc, Pcx.",Affine
Hqwhu Odgb.,Caesar
Uddah Bqnu.,Vigenère
GMLKMTRBBW,Playfair
Erdne aytL.,Rail Fence
Cvzcp Lixy.,Affine
Odgb. Pb Kdqgv duh ri brxu frorxu: exw L vkdph,Caesar
Bqnu. Co Xqxzi who ep oyqh yevkkb: lqj Y cdqwa,Vigenère
SMCBNCBORYXBMKHPHNZMHMPMZMCXSKPBROIU,Playfair
L. drfuoru may yHnsaeo orclu:btIsaedMa  y o  h,Rail Fence
Lixy. Qy Rivxu ipc ah yaep salaep: nez W uriqc,Affine
Wr zhduh d Khduw vr zklwh.,Caesar
Je suknu w Laqbp ck gdyda.,Vigenère
PRUGRMIMCFRMLTNVBFLK,Playfair
Te e weowaeaHats ht. r roi,Rail Fence
Za ocipc i Rcipz ua orwzc.,Affine
Nqrfnh.,Caesar
Adyyao.,Vigenère
GRMHEF,Playfair
Kknceo.,Rail Fence
Gvasgc.,Affine
L khduh d nqrfnlqj dw wkh Vrxwk hqwub:,Caesar
Y raqba k axksuedq qd jra Wkkdd ojjbu:,Vigenère
FBIMMKRIANDEGAINSZPDILMVPDGMZDBW,Playfair
Iaaonteuey er  nciga h ot nr:hekk tSht,Rail Fence
W rcipc i gvasgwvm iz zrc Uaezr cvzpy:,Affine
Uhwbuh zh wr rxu Fkdpehu:,Caesar
Huduho mo jy een Gdqwxub:,Vigenère
MKQDMKUGPRMVMDBOACKM,Playfair
Rre  m:eyew oorCabrt tuhe,Rail Fence
Pczypc oc za aep Sriqncp:,Affine
D olwwoh Zdwhu fohduhv yv ri wklv ghhg.,Caesar
Q vejdhu Mqdah ybowhoo fo yb ddyc toat.,Vigenère
MSKSLPGURSKMEUIMMKPXPAKPBFTBIUKC,Playfair
At eles se iteWtrcersv fti edlla a ohd.,Rail Fence
I lwzzlc Oizcp slcipcu ju ah zrwu xccx.,Affine
Krz hdvlh lv lw wkhq? brxu Frqvwdqflh,Caesar
Xeg ukoyo yc yd jrad? oyqh Sexojkjssa,Vigenère
FHUGBXKFSXKSPDGMHNZMHMAQSRMYKF,Playfair
Hee t?uoaeo ai si hn orCntniwsitey sc,Rail Fence
Rao ciuwc wu wz zrcv? yaep Savuzivswc,Affine
Kdwk ohiw brx yqdwwhqghg.,Caesar
Xqdd vavd oyq fjqdpuxzun.,Vigenère
BOPDULKPHNVWARSZLKRYKC,Playfair
H tuan.ahlf o nteddteyvte,Rail Fence
Rizr lchz yae jvizzcvxcx.,Affine
Nqrfnh.,Caesar
Adyyao.,Vigenère
GRMHEF,Playfair
Kknceo.,Rail Fence
Gvasgc.,Affine
"Khdunh, pruh nqrfnlqj.",Caesar
"Xuknao, wkho axksuedq.",Vigenère
CFRMEFONMKGRMHEKYQ,Playfair
"Hkm cgere oekokn.a,rni",Rail Fence
"Rcipgc, qapc gvasgwvm.",Affine
"Jhw rq brxu Qljkw-Jrzqh, ohdvw rffdvlrq fdoo yv,",Caesar
"Wud ex oyqh Dyqdj-Wegju, bowid emyqceex skhb ri,",Vigenère
IFPRYGMVMAKIDPFNNYLUIMTLMHBMXSNABMSUPUXA,Playfair
"GooNtw scic e nyu ih-on,latocso alv,t rgGee anls",Rail Fence
"Mcz av yaep Vwmrz-Maovc, lciuz assiuwav sill ju,",Affine
Dqg vkhz yv wr eh Zdwfkhuv: eh qrw orvw,Caesar
Qdn iram ri pe xu Mqdyxoni: ro dyp vkid,Vigenère
RABTCFXWTLAHGURSHYKMXIGMRPPMTL,Playfair
As tetrboon hwv ob aces entlsdes Wh:  t,Rail Fence
Ivx urco ju za nc Oizsrcpu: nc vaz lauz,Affine
Vr srruhob lq brxu wkrxjkwv,Caesar
Ie leynuvu sj ikkb jrkkqdjc,Vigenère
PAVHNMLUBGYGMVDZFHWEDPXA,Playfair
Solnuhhopoeyi ortogt r y us,Rail Fence
Ua faapcly wv yaep zraemrzu,Affine
"Pdfe. Wr nqrz pb ghhg,",Caesar
"Cqmx. Je gdys wu naun,",Vigenère
ORHDPRGRNVNCCKKC,Playfair
"M. w dab oko yde,cTnme",Rail Fence
"Qisn. Za gvao qy xccx,",Affine
Nqrfnh.,Caesar
Adyyao.,Vigenère
GRMHEF,Playfair
Kknceo.,Rail Fence
Gvasgc.,Affine
'Wzhuh ehvw qrw nqrz pb vhoih.,Caesar
'Dgaho rooj jed axkm io ouvbu.,Vigenère
QZKMICILQRRPGRNVNCLIPEIU,Playfair
'renk seTeebs o nwm ef.w ttoyl,Rail Fence
'Zocpc ncuz vaz gvao qy uclhc.,Affine
Zdnh Gxqfdq zlwk wkb nqrfnlqj:,Caesar
Mqua Hqdmwd sydd ddo gdyyasjw:,Vigenère
XNEFCZMYRAXGPDPDDGANDEGAIW,Playfair
W cw  cgaeDna ihtykokn:kunthni,Rail Fence
Oigc Xevsiv owzr zry gvasgwvm:,Affine
L zrxog wkrx frxog'vw.,Caesar
Y gkkvz ddee syqbn'id.,Vigenère
GXMVTCPDMVHMMUBTSZ,Playfair
Iut lt ol hucuds.wdoo',Rail Fence
W oaelx zrae saelx'uz.,Affine
Hahxqw.,Caesar
Unoqdd.,Vigenère
IULMRQ,Playfair
Enxute.,Rail Fence
Ctcevz.,Affine
Vfhqd Whuwld.,Caesar
Isojq Jubpyk.,Vigenère
LBGMRSKMSKBA,Playfair
Sar.cn etaeTi,Rail Fence
Uscvi Zcpzwi.,Affine
Hqwhu d Sruwhu. Nqrfnlqj zlwklq.,Caesar
Uddah w Tkhdah. Uxksuedq mspxsj.,Vigenère
GMLKMRVHDZKMGRMHEKYQXGPDGA,Playfair
ErPeKk hne  otr ncigwti.tar.onin,Rail Fence
Cvzcp i Fapzcp. Gvasgwvm owzrwv.,Affine
Sruwhu. Khuh'v d nqrfnlqj lqghhgh: li d pdq zhuh,Caesar
Febpub. Laho'i w ujemgyxc sjtoato: sb k ckj gaho,Vigenère
VHDZKMCFMKXBGRMHEKYQGACKKCFKIOORYNKMIU,Playfair
PeH' cgdefmwotr eesakokn ned:i  a eer.r niie anr,Rail Fence
Fapzcp. Rcpc'u i gvasgwvm wvxccxc: wh i qiv ocpc,Affine
"Sruwhu ri Khoo Jdwh, khh vkrxog kdxh rog wxuqlqj wkh",Caesar
"Febpub ep Rohb Wqda, duo irkkvz rwko evz dqhxedq jra",Vigenère
VHDZKMHPCFSUQERSFCIUILFHMUCYMXFMTCLZMAGAKQCF,Playfair
"Pefla  uh  n otro elGt,hesol aeodtrigter H eehdulunh",Rail Fence
"Fapzcp ah Rcll Mizc, rcc uraelx riec alx zepvwvm zrc",Affine
Nhb.,Caesar
Aui.,Vigenère
EFBW,Playfair
Ke.y,Rail Fence
Gcy.,Affine
Nqrfn.,Caesar
Adyya.,Vigenère
GRMHIZ,Playfair
Kknc.o,Rail Fence
Gvasg.,Affine
"Nqrfn, Nqrfn, Nqrfn. Zkr'v wkhuh",Caesar
"Adyya, Uxksu, Ojemg. Mxy'i pxonu",Vigenère
GRMHIZGRMHIZGRMHGZFHTLCFMK,Playfair
"Kkn,o 'hnc,Kok nc.Wosteeo cKkh r",Rail Fence
"Gvasg, Gvasg, Gvasg. Ora'u zrcpc",Affine
"l'wk' qdph ri Ehochexe? Khuh'v d Iduphu, wkdw kdqj'g",Caesar
"e'dd' jqwa yb Fabjarex? Xuba'c q Vqbiub, ddqd xkjw'z",Vigenère
KSYOROFMIHLUUKCXDYKMILOIRMCLDZBOPDRAKY,Playfair
"i'mfluH' m tn'h aeo ezbb eesaFre,ta agdtn Be?r arhh'",Rail Fence
"w'zr' viqc ah Ncldcnen? Rcpc'u i Hipqcp, zriz rivm'x",Affine
"klpvhoih rq wk' hashfwdwlrq ri Sohqwlh: Frph lq wlph, kdxh",Caesar
"dywouvbu kd px' uhlumpqdeex ep Zvaddeu: Myiu ed pywa, dqea",Vigenère
BFALLUGFNAPDIULFDLRSFAANPVULRQKFHMCLGASKCLBOML,Playfair
"he tecioliC t,uisleo h xetto fPete oei ie aemfn'pan n:mnmh",Rail Fence
"rwquclhc av zr' ctfcszizwav ah Flcvzwc: Saqc wv zwqc, riec",Affine
"Qdsnlqv hqrz derxw brx, khuh brx'oh vzhdw iru'w.",Caesar
"Dqzgyxo ojeg qlkkd oyq, duba ikk'hu omowj beb'j.",Vigenère
ARTFGALIANXNHAZLHNVCKMGCMVULQXIMPKNMSZ,Playfair
"Nie uoh 'strakn nwaotyu eeyul wa o'.psob ,roeeft",Rail Fence
"Vifgwvu cvao inaez yae, rcpc yae'lc uociz hap'z.",Affine
Nqrfn.,Caesar
Adyya.,Vigenère
GRMHIZ,Playfair
Kknc.o,Rail Fence
Gvasg.,Affine
"Nqrfn, nqrfn. Zkr'v wkhuh lq wk' rwkhu Ghxlov Qdph?",Caesar
"Adyya, axksu. Ade'o dduba sj dd' kjrah Tueebc Xkiu?",Vigenère
GRMHIZGRMHGZFHTLCFMKGAPDRPCFDKLMESQAROIU,Playfair
"Kkn.ote  eesmnc,kok h' hr nt'ohrDul aeo cWseiht iN?",Rail Fence
"Gvasg, gvasg. Ora'u zrcpc wv zr' azrcp Xcewlu Viqc?",Affine
"Idlwk khuh'v dq Htxlxrfdwru, wkdw frxog vzhduh lq erwk",Caesar
"Vqspx duba'c qx Oaqyekskpeb, ddqd syqbn igaqba sj lkjr",Vigenère
IOKSBVCFMKXBMGLWEXMHRSNMPDRSHMMUBTUGRMFKAYRPBV,Playfair
"Fhr Eut tusrntat eesa qioao,ta ol waei ohih'nucrhcde b",Rail Fence
"Hiwzr rcpc'u iv Ckeweasizap, zriz saelx uocipc wv nazr",Affine
"wkh Vfdohv djdlqvw hbwkhu Vfdoh, zkr frpplwwhg Wuhdvrq",Caesar
"pxo Cmwboo kcqsjid uipxon Wyqva, sxy syicspjoz Xnukoex",Vigenère
PDILBMULXBINGATLGCPDKMLBMSGUFHHMAUAESZLKKZMKBXNA,Playfair
"tSegsyra  meroh clsaantete cl,wocmitdTesnea i hSehot a",Rail Fence
"zrc Usilcu imiwvuz cyzrcp Usilc, ora saqqwzzcx Zpciuav",Affine
"hqrxjk iru Jrgv vdnh, bhw frxog qrw htxlxrfdwh wr Khdxhq:",Caesar
"adyqwr vyn Kktc ikgu, oop mkkvz xkj ageekyyqda dk Laqead:",Vigenère
GMMVFYPHNKRHXAXBEFCGLDMVTCANLKLWEXMHRSKLHFIMMLAW,Playfair
"egoos,tuneutoa:nuhfrGd ae e ol o qioaet euno  skycdtuc He",Rail Fence
"cvaemr hap Maxu uigc, ycz saelx vaz ckeweasizc za Rciecv:",Affine
"rk frph lq, Htxlxrfdwru.",Caesar
"kx yewa sj, Ugeekyyqdkh.",Vigenère
HFHMCLGAGLXEVMBMPRAZ,Playfair
"ooiEuthcm n qioao. e,ucr",Rail Fence
"ar saqc wv, Ckeweasizap.",Affine
Nqrfn.,Caesar
Adyya.,Vigenère
GRMHIZ,Playfair
Kknc.o,Rail Fence
Gvasg.,Affine
"Nqrfn, Nqrfn, Nqrfn. Zkr'v wkhuh? 'Idlwk khuh'v dq Hqjolvk",Caesar
"Adyya, Uxksu, Ojemg. Mxy'i pxonu? 'Jwydd raho'i wd Udqhycd",Vigenère
GRMHIZGRMHIZGRMHGZFHTLCFMKIOKSBVCFMKXBMGYQSEPB,Playfair
"Kkn,o 'h?a eansnc,Kok nc.Wostee Fihhr' nEgiho cKkh r'tes l",Rail Fence
"Gvasg, Gvasg, Gvasg. Ora'u zrcpc? 'Hiwzr rcpc'u iv Cvmlwur",Affine
"Wdboru frph klwkhu, iru vwhdolqj rxw ri d Iuhqfk Krvh:",Caesar
"Jqiheb syiu dyddub, pkh ojowbsjw kkd ep q Vhojsr Ryou:",Vigenère
SRCQNMHMCLBFPDKMPHATLKMSGAFNZLHPOIMKMYBVFHLI,Playfair
"Toohefsl  ae ealrcm ihr o taigoto  rnhHs:y et,renufFco",Rail Fence
"Ziylap saqc rwzrcp, hap uzcilwvm aez ah i Hpcvsr Rauc:",Affine
"Frph lq Wdboru, khuh brx pdb urvw brxu Jrrvh.",Caesar
"Sewa sj Xwovkh, xonu uee cku bkid oyqh Weyou.",Vigenère
HMCLGASRCQNMCFMKHNMCNBMNTLHNZMFNAPIU,Playfair
"C Toh   tuo.oei alr eeyumyrs orGoemny,roaoy s",Rail Fence
"Saqc wv Ziylap, rcpc yae qiy pauz yaep Maauc.",Affine
Nqrfn.,Caesar
Adyya.,Vigenère
GRMHIZ,Playfair
Kknc.o,Rail Fence
Gvasg.,Affine
"Nqrfn, Nqrfn. Qhxhu dw txlhw: Zkdw duh brx? exw wklv",Caesar
"Adyya, Uxksu. Rakon kp aqyop: Mxkp knu uee? lqj pxso",Vigenère
GRMHIZGRMHGRLMKMRSLWKFQZBOSRMKHNXCZLPDSX,Playfair
"Kkn.uau:arobtnc,Kok ee tqit htaeyu u hso cNr eW  ?ti",Rail Fence
"Gvasg, Gvasg. Vcecp iz kewcz: Oriz ipc yae? nez zrwu",Affine
sodfh lv wrr frog iru Khoo. Loh Ghxloo-Sruwhu lw qr ixuwkhu:,Caesar
lbkyu ei pey syht beb Rohb. Sva Hakshb-Febpub yd dy venjrah:,Vigenère
QPMBFKTLAVMHMPHKNMCFSUSEULCKXESUPQNMLKAKQRHPZMPDKM,Playfair
pe  drlIDlor fhlc stocl o el l eilPre tn ute:aioofH.eu-tiorr,Rail Fence
flisc wu zaa salx hap Rcll. Wlc Xcewll-Fapzcp wz va hepzrcp:,Affine
"L kdg wkrxjkw wr kdxh ohw lq vrph ri doo Surihvvlrqv, wkdw",Caesar
"Y rwt pxyqwrp dk rwko bop sj ckco ep qvh Tnepaiceexo, pxkp",Vigenère
FBRBPDMVFYSZPRBOMLULSKAQNOFMIOSUPQMNGFXAXSNATLBOSZ,Playfair
"Idot et e  fi,a a huh ohu e nsm falPoesos hthtgtalioolrsnt",Rail Fence
