Encrypted_Text,Cipher_Type
Wkh Wudjhglh ri Pdfehwk,Caesar
Jxo Dbwwozyo ep Wkyropx,Vigenère
PDKLMRIFBKFMEOMBCIPD,Playfair
TTe Meh rgdeo abteaifch,Rail Fence
Zrc Zpimcxwc ah Qisnczr,Affine
Dfwxv Sulpxv. Vfrhqd Sulpd.,Caesar
Qsdqi Fhsikc. Wyeojq Fhsiq.,Vigenère
MBLZTQAKCMXALBMFARTOEABA,Playfair
Asi.o mcu rms ceaPiatPuSnr.,Rail Fence
Iszeu Fpwqeu. Usacvi Fpwqi.,Affine
Wkxqghu dqg Oljkwqlqj. Hqwhu wkuhh Zlwfkhv.,Caesar
Jxejton kjt Byqdjxedq. Ijjon ddhoa Aejmduc.,Vigenère
PDWMCKMRRYSEFYQRGAIFRQKMPDMKGUKSHYIL,Playfair
TdaLtgn eiehne n ihnn.EtrtreWthsurdgi eh c.,Rail Fence
Zrevxcp ivx Lwmrzvwvm. Cvzcp zrpcc Owzsrcu.,Affine
1. Zkhq vkdoo zh wkuhh phhw djdlqh?,Caesar
1. Mxoj cdqvh ga ddhoa waud qqwyxa?,Vigenère
VYGMPBMSQUKLDOIULCIUKLNIBSMG,Playfair
1hsl eean.We hl etreme gie nawh ta?,Rail Fence
1. Orcv urill oc zrpcc qccz imiwvc?,Affine
"Lq Wkxqghu, Oljkwqlqj, ru lq Udlqh?",Caesar
"Yd Jxejton, Byqdjxedq, yn sj Vwyxa?",Vigenère
GAPDWMCKMTKIDPAGYQNMGAMRGAIU,Playfair
"IheLtgr nnTudr ihnn,o nRie n,gi ia?",Rail Fence
"Wv Zrevxcp, Lwmrzvwvm, ap wv Piwvc?",Affine
"2. Zkhq wkh Kxuohb-exuohb'v grqh,",Caesar
"2. Mxoj ddu Xkbhui-renbou'c tyju,",Vigenère
VYGMPDFCZMULBDZMULBQHRMG,Playfair
"2htHeuyd,.We h ulybre' oe ner-lsn",Rail Fence
"2. Orcv zrc Replcy-neplcy'u xavc,",Affine
"Zkhq wkh Edwwdloh'v orvw, dqg zrqqh",Caesar
"Mxoj ddu Rqdpqshu'o vkid, kjt sexju",Vigenère
VYGMPDICRSSRESILPMTLRAYZNAMG,Playfair
"W  tel,dnhnteBtal' ot n onehaissawe",Rail Fence
"Orcv zrc Nizziwlc'u lauz, ivx oavvc",Affine
3. Wkdw zloo eh huh wkh vhw ri Vxqqh,Caesar
3. Jxkp gebv ro uba ddu oud ep Cejdo,Vigenère
PDRSXGSUSCIUKMKLCFLIPRIPWMMG,Playfair
3hw etsou.Ta ilb r h e fSne tleeet n,Rail Fence
3. Zriz owll nc cpc zrc ucz ah Uevvc,Affine
1. Zkhuh wkh sodfh?,Caesar
1. Mxonu pxo fvwso?,Vigenère
VYKMKLCFQPMBIU,Playfair
1h  c.Weetepae rhl?,Rail Fence
1. Orcpc zrc flisc?,Affine
2. Ysrq wkh Khdwk,Caesar
2. Lfyj ddu Xukpx,Vigenère
OVNAPDFCIMPD,Playfair
2ptHh.Vo h et nea,Rail Fence
2. Jfav zrc Rcizr,Affine
3. Wkhuh wr phhw zlwk Pdfehwk,Caesar
3. Jxonu pe iuop gejr Wkyropx,Vigenère
PDKMKLNOIUKLXGPDORHDKLBV,Playfair
3h m hch.Teet etwt abt roeiMe,Rail Fence
3. Zrcpc za qccz owzr Qisnczr,Affine
"1. L frph, Judb-Pdonlq",Caesar
"1. Y mkco, Knqi-Wkhasj",Vigenère
EBNOFIMRCNMSEKAW,Playfair
"1 erMi.Icm,Ga-akn o yl",Rail Fence
"1. W saqc, Mpiy-Qilgwv",Affine
"Doo. Sdgrfn fdoov dqrq: idluh lv irxoh, dqg irxoh lv idluh,",Caesar
"Qbv. Twtyya yqvhi wdyj: bqsnu ei beehu, qxz pkkva so pwyba,",Vigenère
MSPQRBMHEDMSPTRANAIOKAFKPIMVULRAHKMVULSXIOKAIU,Playfair
"A ocsofe lafe rl.Pdc al nn ar sfue n ol sfielakla:iio,duia,",Rail Fence
"Ill. Fixasg sillu ivav: hiwpc wu haelc, ivx haelc wu hiwpc,",Affine
Krxhu wkurxjk wkh irjjh dqg ilowklh dbuh.,Caesar
Xeeah pxbkkqd ddu beqcu wdn vshjreu woba.,Vigenère
FHMLDZDOMVFYPDFGNFIFRAHKESPDKFNBMK,Playfair
Hrrhegafha.oe hog h og n iti yeututfedler,Rail Fence
Raecp zrpaemr zrc hammc ivx hwlzrwc iypc.,Affine
Hahxqw.,Caesar
Unoqdd.,Vigenère
IULMRQ,Playfair
Enxute.,Rail Fence
Ctcevz.,Affine
Vfhqd Vhfxqgd.,Caesar
Isojq Iumqdnw.,Vigenère
LBGMBXLEWMBR,Playfair
Sacacn eud.eSn,Rail Fence
Uscvi Ucsevxi.,Affine
"Doduxp zlwklq. Hqwhu Nlqj, Pdofrph, Grqdoedlqh, Ohqra, zlwk",Caesar
"Qbknkw mspxsj. Uddah Ayxc, Cqvyewa, Texwblwyxa, Buxkn, mspx",Vigenère
MSRMMCXGPDGAGMLKDTGAENMSHMCLHRARSCBSMGULANZXKSBV,Playfair
"Auinn gamDlnLxilrmwti.EtrKn,Mloe oabie eo,wta h ei c,na,n h",Rail Fence
"Ilipeq owzrwv. Cvzcp Gwvm, Qilsaqc, Xavilniwvc, Lcvat, owzr",Affine
"dwwhqgdqwv, phhwlqj d eohhglqj Fdswdlqh.",Caesar
"wjdadnwddo, iuopyxc k rvaunedq Mkljkedo.",Vigenère
RSLKRYRALTCLKLGAINCSIUKCGAEYOSSRGAIU,Playfair
"antmiaenaitedns etn  leigCpan.ta,egbd te",Rail Fence
"izzcvxivzu, qcczwvm i nlccxwvm Sifziwvc.",Affine
"Nlqj. Zkdw eorrgb pdq lv wkdw? kh fdq uhsruw,",Caesar
"Ayxc. Mxkp lheyzo iqx yc jrwj? xo skj bafynj,",Vigenère
EKYQVYRSCSAVRHCNRASXPDRSCFBMAMFLNMSZ,Playfair
"K.alyn tenp,ig htbod a sta?h a eotnW omih crr",Rail Fence
"Gwvm. Oriz nlaaxy qiv wu zriz? rc siv pcfapz,",Affine
"Dv vhhphwk eb klv soljkw, ri wkh Uhxrow",Caesar
"Qi ouoiudd lu rei lbscxd, yb ddu Huekbd",Vigenère
BXLILCKLYDBYSXQPKIDPHPPDKMLMMPSZ,Playfair
"Aetysi,  osseehb i lgt fteRul m hphohet",Rail Fence
"Iu uccqczr ny rwu flwmrz, ah zrc Pcealz",Affine
Wkh qhzhvw vwdwh,Caesar
Jxo dosucp cpqda,Vigenère
PDGMGUILLTSRLK,Playfair
Tnsth eetsaeew t,Rail Fence
Zrc vcocuz uzizc,Affine
"Pdo. Wklv lv wkh Vhulhdqw,",Caesar
"Cqv. Xdyc yc jra Wahsaqxp,",Vigenère
ORPLBFXSTLCFLIAKIMRQ,Playfair
"M s  ita.Ti steSren,lhihea",Rail Fence
"Qil. Zrwu wu zrc Ucpwcivz,",Affine
Zkr olnh d jrrg dqg kduglh Vrxoglhu irxjkw,Caesar
Mxy bsgu w qken qxz rwhneu Ieehtsah beecxd,Vigenère
VYMPKEIMFNRHRACYRMBKILMVTCKFOKMVFYSZ,Playfair
Wl oahioifhh ieago n adeSude ogtok ddr lru,Rail Fence
Ora lwgc i maax ivx ripxwc Uaelxwcp haemrz,Affine
'Jdlqvw pb Fdswlxlwlh: Kdloh eudxh iulhqg;,Caesar
'Qkedcp wu Gwfdekspyo: Lwyva lnqea pnyojt;,Vigenère
INGATLNCBMQLEXKSKFBOESICMRMLKOKFRY,Playfair
'nmauea urdGis yCpiii:Hiebaefin;at tt lr e,Rail Fence
'Miwvuz qy Sifzwewzwc: Riwlc npiec hpwcvx;,Affine
"Vdb wr wkh Nlqj, wkh nqrzohgjh ri wkh Eurboh,",Caesar
"Iqi jy jra Oedq, ddu gdysbozwo ep jra Fneihu,",Vigenère
XBDQRPCFEKYQPDFEANUQKCIFHPPDICMNCQIU,Playfair
"Sthi  wgfeo,a oteKn,tekoldeo h ryey  ghne tBl",Rail Fence
"Uiy za zrc Gwvm, zrc gvaolcxmc ah zrc Npaylc,",Affine
Dv wkrx glgvw ohdxh lw,Caesar
Qi pxyq netcp vaqea sp,Vigenère
BXPDMVBKBTLPIMMLKS,Playfair
Ahdtaisto is eu t udle,Rail Fence
Iu zrae xwxuz lciec wz,Affine
"Fds. Grxewixoo lw vwrrg,",Caesar
"Sqz. Hkklpvehb ej ojykt,",Vigenère
BMTHMVDSEVSUSELTPRRH,Playfair
"C bltoa.Dutuli to,pof sd",Rail Fence
"Sif. Xaenzhell wz uzaax,",Affine
"Dv wzr vshqw Vzlpphuv, wkdw grh folqj wrjhwkhu,",Caesar
"Qi pmy izadd Cgecwahc, ddqd tya mhyxc dkwopxon,",Vigenère
BXQZAPLFRQQXEACLATPDRSHRLESEYQPRIFPDKM,Playfair
"Awp mshdcggestosetSimr,ta o ln oehr  nwe teitt,",Rail Fence
"Iu zoa ufcvz Uowqqcpu, zriz xac slwvm zamczrcp,",Affine
Dqg fkrdnh wkhlu Duw: Wkh phuflohvvh Pdfgrqzdog,Caesar
Qdn srkqua ddusn Enj: Dra wahmebooio Wkytyjmkht,Vigenère
RACHFHRIKLCFKARMSZPDLCKMBEULXALIORHCNAXNTC,Playfair
Ackh :ere dan haeterAt h eclseMcowldo irTmisand,Rail Fence
Ivx sraigc zrcwp Ipz: Zrc qcpswlcuuc Qisxavoilx,Affine
"(Zruwklh wr eh d Uhehoo, iru wr wkdw",Caesar
"(Gynjreu pe xu w Varohb, vyn dk ddqd",Vigenère
VNDZBFKLAHIMMKCISUPENMPRPDRS,Playfair
"(t b e  tWrhet eaRbl,frt htoio elooa",Rail Fence
"(Oapzrwc za nc i Pcncll, hap za zriz",Affine
Wkh pxowlsoblqj Yloodqlhv ri Qdwxuh,Caesar
Jxo cehjslbiedq Fshbkjyoo yb Rwjenu,Vigenère
PDLCMUSKQPBGYQXFSUSMAGILHPARLZMK,Playfair
TmiiVas uh utpyn ilne fNtrellglioae,Rail Fence
Zrc qelzwflywvm Jwllivwcu ah Vizepc,Affine
Grh vzduph ysrq klp) iurp wkh Zhvwhuqh Lvohv,Caesar
Teo igwhwa flex xsi) bhyi ddu Mucpubju Yivai,Vigenère
HRILXNMOFUVHOYEAKONOPDGUILLKMAFKTPIL,Playfair
Dsmph mesnso wrevo i)fo h etreIlsea nmrtWe e,Rail Fence
Xac uoipqc jfav rwq) hpaq zrc Ocuzcpvc Wulcu,Affine
"Ri Nhuqhv dqg Jdoorzjurvvhv lv vxssob'g,",Caesar
"Ev Aubjuc qxz Kwbvkmqnecouc yc ielfvu'n,",Vigenère
HPEFMAILRAYKMSPMNQMNXALIXSXALXSVQPBC,Playfair
"OesdlgsiuyfKre n alwrse sspl', naGoos pd",Rail Fence
"Ah Gcpvcu ivx Millaompauucu wu ueffly'x,",Affine
"Dqg Iruwxqh rq klv gdpqhg Txduub vplolqj,",Caesar
"Qdn Pynjeju kd dyc tkidoz Uqqbno ocshyxc,",Vigenère
RAHKNMLZMGNABFTBROMGYTXMAZNDLAESGAIW,Playfair
"AFuoiada l,n otn nhsdme urysiigdre  nQrmn",Rail Fence
"Ivx Hapzevc av rwu xiqvcx Keippy uqwlwvm,",Affine
Vkhz'g olnh d Uhehoov Zkruh: exw doo'v wrr zhdnh:,Caesar
Ixos'n bsgu w Varohbc Grkho: lqj wbv'i pey mowao:,Vigenère
PBGUCTKEIMMKCISUPTVYNMICZLMSPTPRNVIMEF,Playfair
S'iabso  'oe:hwdlk  eel hr:btalstowaee eRlWeul  k,Rail Fence
Urco'x lwgc i Pcncllu Orapc: nez ill'u zaa ocigc:,Affine
Iru eudxh Pdfehwk (zhoo khh ghvhuxhv wkdw Qdph),Caesar
Veb rbwko Wkyropx (mohb duo tooubquc jrwj Dqwa),Vigenère
PHADMRMLORHDKLYVLUPCIUKCILKMMLTLBOQRROIU,Playfair
Fbechehdr tmo ru abt wl e eeusta aeraMe(lesehN),Rail Fence
Hap npiec Qisnczr (ocll rcc xcucpecu zriz Viqc),Affine
"Glvgdbqlqj Iruwxqh, zlwk klv eudqglvkw Vwhhoh,",Caesar
"Tyczqijyxc Jkhdqdo, gejr xso lnqxzycdj Ijoabo,",Vigenère
BKTBNBAGYQPHDZWMGUKSBVBFXIMRRYSXDPTLIULUIU,Playfair
"Danonw  nhteidyigFrue ihhsbadstSel,sn t,tiri e",Rail Fence
"Xwuxiyvwvm Hapzevc, owzr rwu npivxwurz Uzcclc,",Affine
Zklfk vprdn'g zlwk eorrgb hahfxwlrq,Caesar
Mxsyx ocywa'z gejr rvkenu otumqjskd,Vigenère
VYEBBPONRIYZKSYDPMRHCGUIEMSKNA,Playfair
Whodtlyeihc ma' ihbod xctoiskw oeun,Rail Fence
Orwsr uqaig'x owzr nlaaxy ctcsezwav,Affine
"(Olnh Ydorxuv Plqlrq) fdux'g rxw klv sdvvdjh,",Caesar
"(Vsgu Lqvkkbo Qedskd) sknk'z yqj dyc fkoikcu,",Vigenère
SEEFXOPMZMLAGAFAMYRMZCMVPDSXSOXAXBIF,Playfair
"(elsn)r   s,Lk aor iin audothspsaeiVuMoc'uiag",Rail Fence
"(Lwgc Jilaepu Qwvwav) sipe'x aez rwu fiuuimc,",Affine
Wloo khh idf'g wkh Vodxh:,Caesar
Jyvh rau bqm't pxo Cvwko:,Vigenère
SKSUPCIUFGMBKZCFTPMXIU,Playfair
T  'hl:ilhefcdteSaelea  u,Rail Fence
Zwll rcc his'x zrc Uliec:,Affine
"Zklfk qhx'u vkrrnh kdqgv, qru edg iduzhoo wr klp,",Caesar
"Mxsyx jue'h oxykao xkjtc, xkh xqn vknmohb pe dyw,",Vigenère
VYEBYOLMATFHRFFCRABTANADRBIONZLUPLHFEA,Playfair
"Whuska,rdrl ,hc e' hoehns o a awl ohminro dnbfeti",Rail Fence
"Orwsr vce'p uraagc rivxu, vap nix hipocll za rwq,",Affine
"Wloo kh yqvhdp'g klp iurp wkh Qdxh wrwk' Fkrsv,",Caesar
"Jyvh ra fjiowc'z rec bhyi ddu Dqea dkjr' Gdezo,",Vigenère
SKSUPCFUAQIMRCBFOEMNRLCFARMLPRPDHYHVXA,Playfair
"T va  meuo pilh nemdhmfo h aett'Cosles'irtN hh,",Rail Fence
"Zwll rc jvuciq'x rwq hpaq zrc Viec zazr' Srafu,",Affine
Dqg ila'g klv Khdg ysrq rxu Edwwohphqwv,Caesar
Qdn vst'n xso Laqn lzkd kkb Lkpjvacojjc,Vigenère
RAHKSACYSXCFRBOVNAMVADRSLPLCGMLT,Playfair
AfdsapoBlnn i' i edvo u ateetdxhH nrtms,Rail Fence
Ivx hwt'x rwu Rcix jfav aep Nizzlcqcvzu,Affine
"Nlqj. R ydoldqw Frxvlq, zruwkb Jhqwohpdq",Caesar
"Ayxc. E fwbswdd Myqisj, sebpxi Qojjvackj",Vigenère
EKYQHOMSSBRQHMXLGAVNDZYBIFRQULORAW,Playfair
"K.vaCiwheeig  ain osn otyGnlmnnOltu,r ta",Rail Fence
"Gwvm. A jilwivz Saeuwv, oapzry Mcvzlcqiv",Affine
"Fds. Dv zkhqfh wkh Vxqqh 'jlqv klv uhiohfwlrq,",Caesar
"Sqz. Eo gduxyu pxo Cejdo 'qedc xso bavvasdeex,",Vigenère
BMSOQXCFMYKLCFLXAWMGIKAQBFTAFGULDLFAAW,Playfair
"C wchu niecna.A hneteSne'ishsrfeto,pse  ng  li",Rail Fence
"Sif. Iu orcvsc zrc Uevvc 'mwvu rwu pchlcszwav,",Affine
"Vklszudfnlqj Vwruphv, dqg gluhixoo Wkxqghuv:",Caesar
"Ixslmbwsuedq Cdkhwai, qxz nehobkvh Xdkxzubo:",Vigenère
PBFSZNMBEKYQTLNMCLXBRYBKMKEVSUPLCVRYKMXA,Playfair
"Swk r,drlhehprcigSoms n ieulTudr:ianteadf ns",Rail Fence
"Urwfopisgwvm Uzapqcu, ivx xwpchell Zrevxcpu:",Affine
"Vr iurp wkdw Vsulqj, zkhqfh frpiruw vhhp'g wr frph,",Caesar
"Ie bhyi ddqd Cznyxc, sxojso syivynj ouoi'n jy syiu,",Vigenère
PAKONOPDRSTQAKYQVYGMELHMOENMLTIULCKZMHNOIU,Playfair
"Srt i ncos'omofo htSrn,wec ofr emdt oe mapghemte c,",Rail Fence
"Ua hpaq zriz Ufpwvm, orcvsc saqhapz uccq'x za saqc,",Affine
"Glvfrpiruw vzhoov: Pdunh Nlqj ri Vfrwodqg, pdunh,",Caesar
"Tycyewbebp csuvhi: Wknao Usjw kv Isypbkjt, cknao,",Vigenère
BKLBNOPHDZQXLUPTORDTFEGAFNIPHMLPRACRRMEF,Playfair
"Dorwsa g tda,icmotsel:MreKn fSoln,mresf l kioca k",Rail Fence
"Xwusaqhapz uocllu: Qipgc Gwvm ah Usazlivx, qipgc,",Affine
"Qr vrrqhu Lxvwlfh kdg, zlwk Ydorxu dup'g,",Caesar
"De oeyjub Seojsyu dqn, gejr Fkheen knc'z,",Vigenère
ANPANAKMEXTLEBFCRBXGPDXOPMZMRMRC,Playfair
"NorsediVur,osoe utc a,wt aoramd nIih hl '",Rail Fence
"Va uaavcp Weuzwsc rix, owzr Jilaep ipq'x,",Affine
"Frpshoo'g wkhvh vnlsslqj Nhuqhv wr wuxvw wkhlu khhohv,",Caesar
"Sewluvh'n jraio iuefzedq Uondoo dk dnkcp ddusn rauvai,",Vigenère
HMOLLUTCPDILILEKSVSFYQEFMAILPRZDXLSZPDFKODIULUIL,Playfair
"Cedesp ntr iesopl' hs kpigKre otutterhee,mlteines sh l",Rail Fence
"Saqfcll'x zrcuc ugwffwvm Gcpvcu za zpeuz zrcwp rcclcu,",Affine
"Exw wkh Qruzhbdq Orug, vxuxhblqj ydqwdjh,",Caesar
"Rkd jra Rkhgaokj Pkhn, cqheaosjw rqxpqqa,",Vigenère
CXSZPDGMNMUGBNMQNMBTZMMLBGYQXORQNIIU,Playfair
"BtNe duy t,u h owynLr,sreigvnaeterao unag",Rail Fence
"Nez zrc Vapocyiv Lapx, uepecywvm jivzimc,",Affine
"Zlwk ixuexvkw Duphv, dqg qhz vxssobhv ri phq,",Caesar
"Mydd pqhlqirp Encoo, wdn dos cqfzhooo yb wad,",Vigenère
XGPDEVADXLDPRMCLXBRYMGXQVLQPCGPAEOGM,Playfair
"W btm   ps ,ihfruh re,adnwsple fmntusAsneuyoe",Rail Fence
"Owzr hepneurz Ipqcu, ivx vco uefflycu ah qcv,",Affine
Ehjdq d iuhvk dvvdxow,Caesar
Ruqwd w pnucd koikqbd,Vigenère
CIINARKOILBOXAXBMUSZ,Playfair
Bnfhstea  rs salgaeau,Rail Fence
Ncmiv i hpcur iuuielz,Affine
"Nlqj. Glvpdb'g qrw wklv rxu Fdswdlqhv, Pdfehwk dqg",Caesar
"Ayxc. Tyciqi't jed jrei kkb Mkljkedoo, Cqmxudd kjt",Vigenère
EKYQBKLANBYRRPPDSXMVMDOSSRGAILORHDKLBORY,Playfair
"K.s'ohoCasatnig imydntti u atie,McehadnDa  srpn b ",Rail Fence
"Gwvm. Xwuqiy'x vaz zrwu aep Sifziwvcu, Qisnczr ivx",Affine
Edqtxrk?,Caesar
Rqxmkyd?,Vigenère
IBYWVMBV,Playfair
Buaqo?nh,Rail Fence
Nivkear?,Affine
"Fds. Bhv, dv Vsduurzhv, Hdjohv;",Caesar
"Sqz. Cai, qc Czwhbkmoo, Uqqhuc;",Vigenère
BMQHILBXTQRMMNUGLINIULXA,Playfair
"C , reEea.Ys sSarws alspeapo,g;",Rail Fence
"Sif. Ycu, iu Ufippaocu, Cimlcu;",Affine
"Ru wkh Kduh, wkh Obrq:",Caesar
"Eh pxo Rknu, jra Puex:",Vigenère
NMPDFCRMKLCFQCNA,Playfair
"Oha  nrteHr,teLo:  ehy",Rail Fence
"Ap zrc Ripc, zrc Lyav:",Affine
"Li L vdb vrrwk, L pxvw uhsruw wkhb zhuh",Caesar
"Yv Y cwo oeypx, S ikcp bafynj pxou gaho",Vigenère
KGSXNBPARPBFCMTLMKVHDZPDGCUGMK,Playfair
"I  tIseteefIsysoh  utrpr hywr ao,m ot e",Rail Fence
"Wh W uiy uaazr, W qeuz pcfapz zrcy ocpc",Affine
"Dv Fdqqrqv rxhu-fkduj'g zlwk grxeoh Fudfnv,",Caesar
"Qi Sqxjexo yqub-srwhq't sydd nkklhu Shkyac,",Vigenère
BXBMAWANAQMVKMHYRMKYXGPDHRXCULDMMBIT,Playfair
"Aanucgw bCksCnosoe-hr' ihdul rcs n radtoea,",Rail Fence
"Iu Sivvavu aecp-sripm'x owzr xaenlc Spisgu,",Affine
Vr wkhb grxeob uhgrxeohg vwurdnhv ysrq wkh Irh:,Caesar
Ie pxou nkklho nunkklhun idnekguc lzkd pxo Pya:,Vigenère
PAPDGCHRXCQCMKHRXCULBTZDNREFPXVHRQCFPHIU,Playfair
Shdleb osohoote obyrduldsrae pnteFe yu oetkv  :,Rail Fence
Ua zrcy xaenly pcxaenlcx uzpaigcu jfav zrc Hac:,Affine
"Hafhsw wkhb phdqw wr edwkh lq uhhnlqj Zrxqgv,",Caesar
"Unmafd jrao iukjj pe xqddu ed nuogyxc Akkxzi,",Vigenère
IUELQLPDGCCLRASZPRIBPDFKAMIUFEGAQNMVRYXA,Playfair
"Ephmt hnegu,xette en obtei ekn onsc yata riWd",Rail Fence
"Ctscfz zrcy qcivz za nizrc wv pccgwvm Oaevxu,",Affine
"Ru phprulch dqrwkhu Jrojrwkd,",Caesar
"Eh iuwkhsvu wdypxon Kkbqkjrw,",Vigenère
NMCLONAKUKRARPCFNKMPFNPDBA,Playfair
"OeiahGo,rmmrz nte ogta oeorlh",Rail Fence
"Ap qcqapwdc ivazrcp Malmazri,",Affine
"L fdqqrw whoo: exw L dp idlqw,",Caesar
"Y mwdxkj puvh: xkd S wc bqsjj,",Vigenère
EBRAANSZLKSUSCZLSBOEBSRQ,Playfair
"In lu ft anttl:btIa an,coe  mi",Rail Fence
"W sivvaz zcll: nez W iq hiwvz,",Affine
Pb Jdvkhv fub iru khosh,Caesar
Co Wqcduc sbu pkh duvlu,Vigenère
NCINPBILDMHGNMCFPQIU,Playfair
MasyrlyGse r o ep hcfhe,Rail Fence
Qy Miurcu spy hap rclfc,Affine
"Nlqj. Vr zhoo wkb zrugv ehfrph wkhh, dv wkb zrxqgv,",Caesar
"Ayxc. Ie suvh ddo sebzi xumkco jrau, qc jru gkkxzi,",Vigenère
EKYQPAUGSUPLYBVNDKXILENOKLCFIMTLYBVNWMBT,Playfair
"K. lyrbmh twdig owl h od eoete,a h onsnSetwsc esyu,",Rail Fence
"Gwvm. Ua ocll zry oapxu ncsaqc zrcc, iu zry oaevxu,",Affine
Wkhb vpdfn ri Krqru erwk: Jrh jhw klp Vxujhrqv.,Caesar
Jxou ciqmg yb Lkdyn lkjr: Kku cud xsi Wqhqaexo.,Vigenère
PDGCLAMBFRPFNANMHAPDFNFIKLBFALZMIFNAXA,Playfair
T cfnb:etmrnhysako oo oh o e i ugosem HrtGghSe.,Rail Fence
Zrcy uqisg ah Ravap nazr: Mac mcz rwq Uepmcavu.,Affine
Hqwhu Urvvh dqg Dqjxv.,Caesar
Uddah Hecou wdn Kxckc.,Vigenère
GMLKAZMNXALIRABRYQXL,Playfair
ErsaAsne os n nu.tRedg,Rail Fence
Cvzcp Pauuc ivx Ivmeu.,Affine
Zkr frphv khuh?,Caesar
Mxy syiuc xonu?,Vigenère
VYMHNOILCFMK,Playfair
Wcsrh oe eeomh?,Rail Fence
Ora saqcu rcpc?,Affine
Pdo. Wkh zruwkb Wkdqh ri Urvvh,Caesar
Cqv. Xdu sebpxi Drwdo ep Byoio,Vigenère
ORPLCFVNDZYBPDRAFMKOAPLI,Playfair
M  tTe sa.Tewrh hn fRselhoyaoo,Rail Fence
Qil. Zrc oapzry Zrivc ah Pauuc,Affine
Ohqra. Zkdw d kdvwh orrnhv wkurxjk klv hbhv?,Caesar
Buxkn. Grwj w rwida vkeuai pxbkkqd rei aooo?,Vigenère
ULANZXBOSRBOTLLUAVRFILPDMNWEBVBFLICGXA,Playfair
Lxhaslehgiyeo.Wa  at okstruhhsee?n theo o  s,Rail Fence
Lcvat. Oriz i riuzc laagcu zrpaemr rwu cycu?,Affine
"Vr vkrxog kh orrnh, wkdw vhhphv wr vshdnh wklqjv vwudqjh",Caesar
"Ie oxyqbn xo bykao, ddqd ioacoo dk clukgu pxsjwc idnqxcu",Vigenère
PAPBMVTCCFPMRFKLBOLTIULCILPRTQIMEFPDGAIQTLMRYQIU,Playfair
"Shd kt mtpei aosol eloe htsee osek hnssrne uho,aes atgtg",Rail Fence
"Ua uraelx rc laagc, zriz uccqcu za ufcigc zrwvmu uzpivmc",Affine
Urvvh. Jrg vdxh wkh Nlqj,Caesar
Hecou. Qyz cwko jra Oedq,Vigenère
MNXALIFNBTMXKLCFEKYQ,Playfair
ReoatKos.Gdsu h igs  een,Rail Fence
Pauuc. Max uiec zrc Gwvm,Affine
"Nlqj. Zkhqfh fdp'vw wkrx, zruwkb Wkdqh?",Caesar
"Ayxc. Mxojso ski'cp ddee, gkhddo Jxkju?",Vigenère
EKYQVYGMELBMALSZPDMVVNDZYBPDRAIU,Playfair
"K.e 't,r nig hnecms hu otyTaenWcatowhh?",Rail Fence
"Gwvm. Orcvsc siq'uz zrae, oapzry Zrivc?",Affine
"Urvvh. Iurp Iliih, juhdw Nlqj,",Caesar
"Hecou. Pbkc Vypbu, wbaqd Usjw,",Vigenère
MNXALIKONOGKIVGFKNIMZTGAIW,Playfair
"RerFer gos.Fo if,getKn,s mf ai",Rail Fence
"Pauuc. Hpaq Hwhhc, mpciz Gwvm,",Affine
"Zkhuh wkh Qruzhbdq Edqqhuv iorzw wkh Vnlh,",Caesar
"Mxonu pxo Xynmouqx Lkjdoni bbysj pxo Cueu,",Vigenère
VYKMKLCFANNZGCRAIBAWMGATEPNVSZPDILEKIU,Playfair
"Weeraarl  ehr h owynBnesfotteSi,etNe n whk",Rail Fence
"Orcpc zrc Vapocyiv Nivvcpu hlaoz zrc Ugwc,",Affine
Dqg idqqh rxu shrsoh frog.,Caesar
Qdn vkjdo een zaezhu yevz.,Vigenère
RAHKRAMGMVOTFMQPLEMPBZ,Playfair
Afero dn an u epecl.dnoplo,Rail Fence
Ivx hivvc aep fcaflc salx.,Affine
"Qruzdb klpvhoih, zlwk whuuleoh qxpehuv,",Caesar
"Debsqi xsiiohvo, gejr jonhsxbo deironi,",Vigenère
ANNZNBBFALLUGFXGPDLKAZAKCSGMMCCIAT,Playfair
"Nail hrlurowyhmef,wt erbenmesr seiti b,",Rail Fence
"Vapoiy rwquclhc, owzr zcppwnlc veqncpu,",Affine
"Dvvlvwhg eb wkdw prvw glvorbdoo Wudbwru,",Caesar
"Qiceidat xo pxkp wkid tsobyuqvh Xnqipeb,",Vigenère
BXXSTLKCDBPDRSONTLBKTPNHMSPLMRDQNM,Playfair
"As t tsaTtsitdb htms ilyl ryo,seyaodolar",Rail Fence
"Iuuwuzcx ny zriz qauz xwulayill Zpiyzap,",Affine
"Wkh Wkdqh ri Fdzgru, ehjdq d glvpdoo Frqiolfw,",Caesar
"Jxo Drwdo ep Mkstyn, xuqwd w neiwwbv Myjvvesd,",Vigenère
PDKLBOMGHPBMZYNMCIINARBKLAMSUENAEPEBSZ,Playfair
"TTe d a m fth hn fCwo,bgnadsalCnlc,eaoare iloi",Rail Fence
"Zrc Zrivc ah Sioxap, ncmiv i xwuqill Savhlwsz,",Affine
"Wloo wkdw Ehoorqd'v Eulghjurrph, odsw lq surrih,",Caesar
"Jyvh ddqd Lohbyjq'o Fnynawbkewa, hqzp sj zneybu,",Vigenère
SKSUPLBOSDLUPMARXIAKCKKNAVNOLUOSSKOQMNHPIU,Playfair
"T tlaBeo t oilta eln' rdgom,lp npof,lhBosireaire",Rail Fence
"Zwll zriz Ncllavi'u Npwxcmpaaqc, lifz wv fpaahc,",Affine
"Frqiurqwhg klp zlwk vhoih-frpsdulvrqv,",Caesar
"Sexbhyjjoz rec sydd cabpa-mkczwhsoexo,",Vigenère
HMOGMNRQKCBFNUKSBPLUGFHMOLRMSXNAXA,Playfair
"Creiisemisofotdhmwt ef-oprsn,nn  hlcao",Rail Fence
"Savhpavzcx rwq owzr uclhc-saqfipwuavu,",Affine
"Srlqw djdlqvw Srlqw, uhehoolrxv Duph 'jdlqvw Duph,",Caesar
"Fesjj wwkedcp Tkyxp, nulabveeeo Enco 'qwyxoj Qhwa,",Vigenère
VHGASRINGATLVHGAZDICLUSEMVXBMOFIBSAQSRMOIU,Playfair
"Ptati eoA i eon gis on,rbliu re'antAm,ianPtelsmgsr",Rail Fence
"Fawvz imiwvuz Fawvz, pcncllwaeu Ipqc 'miwvuz Ipqc,",Affine
"Fxuelqj klv odxlvk vslulw: dqg wr frqfoxgh,",Caesar
"Skbxyxc rei hqeeir izehsp: wdn jy syjsvqto,",Vigenère
EMADGAFYSXSMXEPBTQKAKSRAKZMHNAEUZCIU,Playfair
"Cihlsptnondubn i aihsii:adt ocuergsu r  cl,",Rail Fence
"Sepnwvm rwu liewur ufwpwz: ivx za savslexc,",Affine
Wkh Ylfwrulh ihoo rq yv,Caesar
Jxo Fsyjynyo vohb kd ri,Vigenère
PDFUEBPRAKFGLUPMOWXA,Playfair
TVo l h itrefl nvecieos,Rail Fence
Zrc Jwszapwc hcll av ju,Affine
Nlqj. Juhdw kdsslqhvvh,Caesar
Ayxc. Whowj dqzlyxaica,Vigenère
EKYQKNIMPDOSSFMGXALI,Playfair
K.ehisig ra apnsenGtpe,Rail Fence
Gwvm. Mpciz riffwvcuuc,Affine
"Urvvh. Wkdw qrz Vzhqr, wkh Qruzdbhv Nlqj,",Caesar
"Hecou. Drwj jeg Cgady, ddu Debsqiai Ayxc,",Vigenère
MNXALIPDRSANXQUGANPDGMNMXNCGTIGAIW,Playfair
"RehnSohoyK,os.Ta o wn,teNrae igs twe  wsn",Rail Fence
"Pauuc. Zriz vao Uocva, zrc Vapoiycu Gwvm,",Affine
Fudxhv frpsrvlwlrq:,Caesar
Shkquc syifyoydeex:,Vigenère
DMMXILHMOLAPKSFAAW,Playfair
Ceosoruscmoiina pt:,Rail Fence
Spiecu saqfauwzwav:,Affine
"Qru zrxog zh ghljqh klp exuldoo ri klv phq,",Caesar
"Deb myqbn mo toewxa rec xkbeqvh yb rei iux,",Vigenère
ANNZMVTCUGCKKIMGBFACZMSBSUPMPFSXCLAW,Playfair
"Nwd ghbaoieo ol edin i uil fhsmnruweemrl  ,",Rail Fence
"Vap oaelx oc xcwmvc rwq nepwill ah rwu qcv,",Affine
"Wloo kh glvexuvhg, dw Vdlqw Frophv bqfk,",Caesar
"Jyvh ra neilqhcat, qd Ckedd Myhcoo ijsr,",Vigenère
SKSUPCKCSXCXATKCRSXBGALDMPCLQBMYBV,Playfair
"T dudtiCenilh ibre,a an omsyc,less Stl h",Rail Fence
"Zwll rc xwunepucx, iz Uiwvz Salqcu yvsr,",Affine
"Whq wkrxvdqg Grooduv, wr rxu jhqhudoo yvh",Caesar
"Jux jrkkcwdn Nyhbkni, jy een qadonqvh fou",Vigenère
LKRQFHXLRABZHRSUSMATPRMVNKGMKMMSPULI,Playfair
"Tts l,  elee huadDlas oorgnrl snonortueav",Rail Fence
"Zcv zraeuivx Xallipu, za aep mcvcpill juc",Affine
Nlqj. Qr pruh wkdw Wkdqh ri Fdzgru vkdoo ghfhlxh,Caesar
Ayxc. De ieba ddqd Drwdo ep Mkstyn cdqvh nasoeko,Vigenère
EKYQANONMKPDRSPDRAFMEHNXHRATBOSUTCLEFKML,Playfair
K. eah Coh eig omr htTaeo adrsaldcienNot nfw leu,Rail Fence
Gwvm. Va qapc zriz Zrivc ah Sioxap urill xcscwec,Affine
"Rxu Ervrph lqwhuhvw: Jrh surqrxqfh klv suhvhqw ghdwk,",Caesar
"Ekb Lyoewa sjjonucp: Weo fbkdyqdma rei lhoouxp naqdd,",Vigenère
MVADAPNOFKRQKMILQKMFTONAMVMYFCSXTOILGMZKIMPD,Playfair
"OBmne  ncirne,u ooeitrs:Gepoonehspeetdahrs etoru  s t",Rail Fence
"Aep Nauaqc wvzcpcuz: Mac fpavaevsc rwu fpcucvz xcizr,",Affine
Dqg zlwk klv iruphu Wlwoh juhhw Pdfehwk,Caesar
Qdn mspx dyc vyncon Xejva qnuop Qwslajr,Vigenère
RAYZKSBVBFPINMCLDZKSULKNIUKLORHDKLBV,Playfair
Aw  mTeeMen ihhsfre il re abtdtiortgtch,Rail Fence
Ivx owzr rwu hapqcp Zwzlc mpccz Qisnczr,Affine
Urvvh. Loh vhh lw grqh,Caesar
Hecou. Sva cau ej zexa,Vigenère
MNXALIESILIUFKZKNAIU,Playfair
Reletnos.Iesei oes   d,Rail Fence
Pauuc. Wlc ucc wz xavc,Affine
"Nlqj. Zkdw kh kdwk orvw, Qreoh Pdfehwk kdwk zrqqh.",Caesar
"Ayxc. Mxkp ra rwjr byoj, Xyxbo Wkyropx dqdd gkdxa.",Vigenère
EKYQVYRSCFBOPDPMTLANCSLCMBCIPDBOPDVNAWMG,Playfair
"K.aeto lataweig hth ahls,NbeMcehht on.nW h to b hn",Rail Fence
"Gwvm. Oriz rc rizr lauz, Vanlc Qisnczr rizr oavvc.",Affine
Hahxqw.,Caesar
Unoqdd.,Vigenère
IULMRQ,Playfair
Enxute.,Rail Fence
Ctcevz.,Affine
Vfhqd Whuwld.,Caesar
Isojq Jubpyk.,Vigenère
LBGMRSKMSKBA,Playfair
Sar.cn etaeTi,Rail Fence
Uscvi Zcpzwi.,Affine
Wkxqghu. Hqwhu wkh wkuhh Zlwfkhv.,Caesar
Jxejton. Uddah pxo jrnuo Gspsrai.,Vigenère
PDWMCKMKRQKMPDKLDOIUGUKSHYIL,Playfair
Td ehh c.hne.EtrtetreWthsurn  eie,Rail Fence
Zrevxcp. Cvzcp zrc zrpcc Owzsrcu.,Affine
"1. Zkhuh kdvw wkrx ehhqh, Vlvwhu?",Caesar
"1. Mxonu dqcp ddee roado, Weidah?",Vigenère
VYKMFCBXSZPDMVCIGMILSXLKAZ,Playfair
"1h toe,s?.Weehs hubee itr rat nSe",Rail Fence
"1. Orcpc riuz zrae nccvc, Uwuzcp?",Affine
2. Nloolqj Vzlqh,Caesar
2. Ayvhyxc Wsyxa,Vigenère
EKSUSEYQQXGAIU,Playfair
2inw.KligSie l n,Rail Fence
2. Gwllwvm Uowvc,Affine
"3. Vlvwhu, zkhuh wkrx?",Caesar
"3. Iycpub, gduba ddee?",Vigenère
XSTLKMVYKMKLFHVZ,Playfair
"3irh u.Sse,weeto? t rh",Rail Fence
"3. Uwuzcp, orcpc zrae?",Affine
"1. D Vdboruv Zlih kdg Fkhvwqxwv lq khu Odssh,",Caesar
"1. Q Wwovkhc Gsbu dqn Mraidjkdo sj rah Bqzlu,",Vigenère
BXNBPMATXGGFBOCHCFTLMWLTGACFMTOSLF,Playfair
"1 l edeuiea,.ASyosWf a hsnt nhrLpe arihCts  p",Rail Fence
"1. I Uiylapu Owhc rix Srcuzvezu wv rcp Liffc,",Affine
"Dqg prxqfkw, & prxqfkw, dqg prxqfkw:",Caesar
"Qdn cyqdmdj, & ieejsrp, wdn cyqdmdj:",Vigenère
RACRMVMYDPONWMHYSRRYONWMHYSZ,Playfair
"Amc ohamcn onh,&muct n onh:dut n,dut",Rail Fence
"Ivx qaevsrz, & qaevsrz, ivx qaevsrz:",Affine
"Jlxh ph, txrwk L.",Caesar
"Wyea wa, mkypx Y.",Vigenère
IKMLCLLWRPBF,Playfair
"G  t.iem,qohIueu ",Rail Fence
"Mwec qc, keazr W.",Affine
"Durbqw wkhh, Zlwfk, wkh uxpsh-ihg Urqbrq fubhv.",Caesar
"Qhyudd jrau, Gspsr, ddu nkwlu-bun Byjoyj mnooo.",Vigenère
RMNHRQPDIUGUKSHYPDKMMCLFGFKDNAHNMYNDIL,Playfair
"Anh ctredn erytte,Wth h up-e oyncyso ei,emfRor.",Rail Fence
"Ipayvz zrcc, Owzsr, zrc peqfc-hcx Pavyav spycu.",Affine
"Khu Kxvedqg'v wr Dohssr jrqh, Pdvwhu r'wk' Wljhu:",Caesar
"Xub Reorkjt'o dk Ehuzle cexa, Cqcpub e'px' Dscub:",Vigenère
CFODXLIBRYTLNRULSVVHFNMGORTLKMRPDPKIKM,Playfair
"HHas pg,s hi:e ubn' oAep oe atrot'TgrrsdtlonMe' e",Rail Fence
"Rcp Reunivx'u za Ilcffa mavc, Qiuzcp a'zr' Zwmcp:",Affine
"Exw lq d Vbxh Loh wklwkhu vdboh,",Caesar
"Rkd yx q Ioea Mhu pxspxon cwova,",Vigenère
CXSKARQBMLESKLBFPDKMXBCQIU,Playfair
"Bi eeiryu naSu l hte al,t yIthse",Rail Fence
"Nez wv i Uyec Wlc zrwzrcp uiylc,",Affine
"Dqg olnh d Udw zlwkrxw d wdboh,",Caesar
"Qdn bsgu w Vwj syddeep k jkubo,",Vigenère
RACTKEIMMRQZKSFHZLRSNBUL,Playfair
"Al aiu ln ieaRtwtotatyedk  h a,",Rail Fence
"Ivx lwgc i Piz owzraez i ziylc,",Affine
"Loh grh, Loh grh, dqg Loh grh",Caesar
"Ybo tya, Ybo tya, wdn Sva nku",Vigenère
ESKCMFESKCMFRABKULHRIU,Playfair
"Id  ,deel o,Iede n l oeeloaId",Rail Fence
"Wlc xac, Wlc xac, ivx Wlc xac",Affine
2. Loh jlxh wkhh d Zlqgh,Caesar
2. Ybo wsqu pxoa k Gsjto,Vigenère
ESFIEXKLCFIMXGRYIU,Playfair
2lit i.Iegu heaWne  ee d,Rail Fence
2. Wlc mwec zrcc i Owvxc,Affine
1. Wk'duw nlqgh,Caesar
1. Jx'whd asjto,Vigenère
PDRMZTGACK,Playfair
1htn.T'r id ake,Rail Fence
1. Zr'ipz gwvxc,Affine
3. Dqg L dqrwkhu,Caesar
3. Qdn S wdypxon,Vigenère
RABKRARPCFAZ,Playfair
3n t.AdIaohr  ne,Rail Fence
3. Ivx W ivazrcp,Affine
"1. L pb vhoih kdxh doo wkh rwkhu,",Caesar
"1. Y wu cabpa rwko qvh ddu kjrah,",Vigenère
EABQLUGFBOMLMSPLCFRPCFAZ,Playfair
"1 seulht,.Im ef aealteohr ylh   e",Rail Fence
"1. W qy uclhc riec ill zrc azrcp,",Affine
"Dqg wkh yhub Sruwv wkhb eorz,",Caesar
"Qdn jra fahi Zynjc jrao xbys,",Vigenère
RAKZCFUFNDVHDZTLCFBDPMXZ,Playfair
"Atv thb,n h eyPrste lwdero yo",Rail Fence
"Ivx zrc jcpy Fapzu zrcy nlao,",Affine
"Doo wkh Txduwhuv wkdw wkhb nqrz,",Caesar
"Qbv jra Uqqbpubo ddqd jrao gdys,",Vigenère
MSPLCFLWRMLKATPDRSPDGCGRNV,Playfair
"AtQt tenl h uresta hyko,learht w",Rail Fence
"Ill zrc Keipzcpu zriz zrcy gvao,",Affine
L'wk' Vkls-pdqv Fdug.,Caesar
Y'dd' Ixsl-wwdc Mknt.,Vigenère
KSBPBFLORALBRMBZ,Playfair
