Encrypted_Text,Cipher_Type
SMCBXSQZNMPDHGAKGMBTNCPMDKSXHPLKRQCVXA,Playfair
"L.tr e: d ehay i otyFins yLr sotntu,dSwhrdmoif s",Rail Fence
"Lixy. Uwz oapzry Hpwcvxu: qy Lapx wu ahzcv zreu,",Affine
"Dqg kdwk ehhqh iurp klv brxwk. Sudb brx nhhsh Vhdw,",Caesar
"Qdn xkpx xuoju bhyi rei ueepx. Zbwo uee aoafo Cowj,",Vigenère
RACYRSYDIUGMFGMNOCSXHNZLFVMRBWHNZEIUFLILIMSZ,Playfair
"Ah nrhyhrykean ahbeefo i ot.Pa o ep etdte msu yueS,",Rail Fence
"Ivx rizr nccvc hpaq rwu yaezr. Fpiy yae gccfc Uciz,",Affine
"Wkh ilw lv prphqwdub, ysrq d wkrxjkw",Caesar
"Jxo vsp so wkcojjkno, lzkd w ddeecxd",Vigenère
PDFGKSSXONCLRQRMHWVHARPDMVFYSZ,Playfair
"Tfiot,o uh i smmnay pnatogtet erv hh",Rail Fence
"Zrc hwz wu qaqcvzipy, jfav i zraemrz",Affine
Kh zloo djdlqh eh zhoo. Li pxfk brx qrwh klp,Caesar
Xu syvh kcqsju xu suvh. Yv ikmd ikk jeda rec,Vigenère
CFXGSUSMINGAICGULUSEEOMEYBMVANLKBFAU,Playfair
HianelIuyn ewl gieb el fmc o oehm la w. huti,Rail Fence
Rc owll imiwvc nc ocll. Wh qesr yae vazc rwq,Affine
"Brx vkdoo riihqg klp, dqg hawhqg klv Sdvvlrq,",Caesar
"Oee irwbv epbuxz rec, qxz otjojt dyc Zkoiskd,",Vigenère
HNXLBOSUPMIVGFRYBFORRYIULKRYBFTQBXXSNA,Playfair
"Yslf ,dt  s,o hl fedhm n xedhsPsinuaoniaeniao",Rail Fence
"Yae urill ahhcvx rwq, ivx ctzcvx rwu Fiuuwav,",Affine
"Ihhg, dqg uhjdug klp qrw. Duh brx d pdq?",Caesar
"Vuoz, wdn hocqbz rec jed. Enu uee q iqx?",Vigenère
GFKCRAKDFIRMCYEAANSRMKHNXMORAW,Playfair
"F,dg  .eumed n eadhmnt r o  a?earrioAyan",Rail Fence
"Hccx, ivx pcmipx rwq vaz. Ipc yae i qiv?",Affine
"Pdfe. L, dqg d erog rqh, wkdw gduh orrnh rq wkdw",Caesar
"Cqmx. Y, wdn q xevz yju, jrwj zqba vkeua yj ddqd",Vigenère
ORHDSBRYBIMPHRMGPDRSBRMKPMRFFMRQBOSZ,Playfair
"M.  oo tro tab ,adabl n,ta aeloeo htcIn dehd kna",Rail Fence
"Qisn. W, ivx i nalx avc, zriz xipc laagc av zriz",Affine
Zklfk pljkw dssdoo wkh Glxhoo,Caesar
Mxsyx iyqdj wfzwbv jra Hekohb,Vigenère
VYEBCOKIDPOSSOSUPLCFBKMLSUSU,Playfair
Whgalhilhc ih palteDulimtp  e,Rail Fence
Orwsr qwmrz iffill zrc Xwecll,Affine
Od. R surshu vwxiih:,Caesar
Bq. Y lhylub idqvpa:,Vigenère
SMHVMNLFATLZIVGF,Playfair
LOo fa  rprsuf:.pete,Rail Fence
Li. A fpafcp uzehhc:,Affine
Wklv lv wkh yhub sdlqwlqj ri brxu ihduh:,Caesar
Jxso so ddu rubu zwyxpyxc yb ikkb vowho:,Vigenère
PDSXSXPDFUKMHQBSRQGAFNGHMVOKIMMK,Playfair
T tv ng rahsi h eypitn fyu er:iseraioofe,Rail Fence
Zrwu wu zrc jcpy fiwvzwvm ah yaep hcipc:,Affine
Wklv lv wkh Dbuh-gudzqh-Gdjjhu zklfk brx vdlg,Caesar
Jxso so ddu Qoba-nnqgju-Tqqcub mresr oyq cwyn,Vigenère
PDSXSXPDIMDNKCMRNYKCNIIFNZBFHYHNXLBSBZ,Playfair
T tA-wDeh  dhsi h yedan-agrwihyusiiserreg coa,Rail Fence
Zrwu wu zrc Iypc-xpiovc-Ximmcp orwsr yae uiwx,Affine
"Ohg brx wr Gxqfdq. R, wkhvh iodzhv dqg vwduwv",Caesar
"Bun oyq dk Hqdmwd. Y, jraio vvwmoo kjt ojknjc",Vigenère
ULCBMVPRCZMYRARPCFLIEPNXILRABTSRDZXA,Playfair
"Lytun,efentse o oDna.O hs lwsadsatdu c tea  r",Rail Fence
"Lcx yae za Xevsiv. A, zrcuc hliocu ivx uzipzu",Affine
(Lpsrvwruv wr wuxh ihduh) zrxog zhoo ehfrph,Caesar
(Swlecpebo dk dnko vowho) gkkvz gabv royewa,Vigenère
EAVHTLNMTLRPMZFGIMMKVNMUYZLUSCLENOIU,Playfair
(oroue)uw oIpsost refae ol elbcmmt t rwdlee,Rail Fence
(Wqfauzapu za zpec hcipc) oaelx ocll ncsaqc,Affine
"D zrpdqv vwrub, dw d Zlqwhuv iluh",Caesar
"Q gkckji ojyno, qd q Myxpubo peho",Vigenère
NXNORAXATLNMBNSRXGRQKMPIKAIU,Playfair
"Am ra t e oassoy taWnesfrwnt, iri",Rail Fence
"I oaqivu uzapy, iz i Owvzcpu hwpc",Affine
"Dxwkrulc'g eb khu Judqgdp: vkdph lw vhoih,",Caesar
"Qkddebep'z lu rah Whkjtki: oxkiu ej ouvbu,",Vigenère
MXPDNMKXCDBYKMKNRABRALBOCLKSLIPEIU,Playfair
"Ao'yramh seuhrzdb e rna:saei ef,ti hGd mtl",Rail Fence
"Iezrapwd'x ny rcp Mpivxiq: uriqc wz uclhc,",Affine
Zkb gr brx pdnh vxfk idfhv? Zkhq doo'v grqh,Caesar
Mxi ty oyq wwao ieyx bqmai? Grad wbv'i zexa,Vigenère
VYBCNHMVOREFLXHYIOELQXCFARSUPTHRMG,Playfair
Wdoas eW 'oh oyumk uhfcs hnalsdny  eca?el e,Rail Fence
Ory xa yae qigc uesr hiscu? Orcv ill'u xavc,Affine
Brx orrnh exw rq d vwrroh,Caesar
Oee bykao rep yj k idkeva,Vigenère
HNMUAVRFICZLNABXPRMPIU,Playfair
Ylet teo ok u nasoluobo o,Rail Fence
Yae laagc nez av i uzaalc,Affine
Pdfe. Subwkhh vhh wkhuh:,Caesar
Cqmx. Fhipxoa cau pxonu:,Vigenère
ORHDTODQCFILIUKLCFMK,Playfair
M.yeeeab rte e hr:cPhste,Rail Fence
Qisn. Fpyzrcc ucc zrcpc:,Affine
"Ehkrog, orrnh, orh, krz vdb brx:",Caesar
"Rurkbn, vkeua, heo, rkm oqi oyq:",Vigenère
CIFHTCPMRFLUMFFHXQNBHNVZ,Playfair
"Blleohsyeod ok,le o a o:h,o ,wyu",Rail Fence
"Ncralx, laagc, lac, rao uiy yae:",Affine
"Zkb zkdw fduh L, li wkrx fdqvw qrg, vshdnh wrr.",Caesar
"Mxi mrwj yqba M, sb ddee skjid dyz, ofowao jyk.",Vigenère
VYGNBOLDRMFKKGPDMVBMAQQRRHTQIMEFPRAV,Playfair
"Ww e t soskoh htcr ,i hucntnd paetoyaaIfoa ,e .",Rail Fence
"Ory oriz sipc W, wh zrae sivuz vax, ufcigc zaa.",Affine
"Li Fkduqhoo krxvhv, dqg rxu Judxhv pxvw vhqg",Caesar
"Yv Sxkndohb deeouc, kjt kkb Qbwkoo wqid iojt",Vigenère
KGHYRMMGSUPCMVLIXBRYMVNKMRMLLAXLLTGMBZ,Playfair
"IheheaoGeusfCanl oss n u rusms ed rlu,dra tn",Rail Fence
"Wh Sripvcll raeucu, ivx aep Mpiecu qeuz ucvx",Affine
"Wkrvh wkdw zh exub, edfnh; rxu Prqxphqwv",Caesar
"Jxyou pxkp ga lqhi, lwsua; kkb Wyjkwaddo",Vigenère
PDAPKLBOQZICZMBDMBEFMVMONAMCGMLT,Playfair
"Teaerbeuoehs htw uy ak;orMnmnsot b,c  ut",Rail Fence
"Zrauc zriz oc nepy, nisgc; aep Qaveqcvzu",Affine
Vkdoo eh wkh Pdzhv ri Nbwhv,Caesar
Ixkhb xu pxo Wksuc ep Uipuc,Vigenère
PBMSSCKLCFORUGPAGEDQIL,Playfair
Sl  efthl eteMwso yeabha Ks,Rail Fence
Urill nc zrc Qiocu ah Gyzcu,Affine
Od. Zkdw? txlwh yqpdqq'g lq iroob,Caesar
Bq. Grwj? geejo lxiqxj'n yx vyhbi,Vigenère
SMVYRSLWKSFUAORARYGAPHSUQC,Playfair
LW?ivn fya ht ut nandi ol.aqem'nl,Rail Fence
Li. Oriz? kewzc jvqivv'x wv hally,Affine
"Pdfe. Li L vwdqg khhuh, L vdz klp",Caesar
"Cqmx. Yv Y cpqxz rauba, Y cwm dyw",Vigenère
ORHDKGSXSRRYCFKMFKXBVYEA,Playfair
"M. t rIwmab fIsadhee  a icI ne,sh",Rail Fence
"Qisn. Wh W uzivx rccpc, W uio rwq",Affine
Od. Ilh iru vkdph,Caesar
Bq. Psa pkh oxkiu,Vigenère
SMGKFGNMPBROIU,Playfair
LFfsea i o hm.era,Rail Fence
Li. Hwc hap uriqc,Affine
"Pdfe. Eorrg kdwk ehqh vkhg huh qrz, l'wk' roghq wlph",Caesar
"Cqmx. Rbykt dqdd lado irat aho dys, e'dd' kbnad pywa",Vigenère
ORHDCSAVRHBOPDCIMGPBKCKMGMNVKSFHTCGMSKCL,Playfair
"M.oh eeroi'dtab lo ahbn hdeenw 'h le iecBdtes  ,tonm",Rail Fence
"Qisn. Nlaax rizr ncvc urcx cpc vao, w'zr' alxcv zwqc",Affine
Huh kxpdqh Vwdwxwh sxuj'g wkh jhqwoh Zhdoh:,Caesar
Uho xeiqxa Wpqdqjo fenw'z ddu cuxpbo Gowbo:,Vigenère
KMFCMCRAILSRLZLKLVNKKZCFIFRQULUGMSIU,Playfair
Ehnttuden lr uaeSauepr' h eteWaeem t gtgle:,Rail Fence
Cpc reqivc Uzizezc fepm'x zrc mcvzlc Ocilc:,Affine
"L, dqg vlqfh wrr, Pxuwkhuv kdxh ehqh shuirup'g",Caesar
"Y, wdn isjso jyk, Ckbpxoni dqea lado fonvync'z",Vigenère
SBRYXSMYKLAVNOZMPDKMPBMXICGMFLKMPHMOBZ,Playfair
"Ini ,rrab f',adsneto uteshu eepromd  coMh ener",Rail Fence
"W, ivx uwvsc zaa, Qepzrcpu riec ncvc fcphapq'x",Affine
"Wrr whuuleoh iru wkh hduh. Wkh wlphv kdv ehqh,",Caesar
"Jey jonhsxbo vyn ddu aqba. Jxo jsiuc xko lado,",Vigenère
PRRPKMAKCSFGNMPDIUIMMKPDKLEAILBOXIGMIU,Playfair
"Tti   ehi  eo erbefrteer.Tetmshsbn,orloha  eae",Rail Fence
"Zaa zcppwnlc hap zrc cipc. Zrc zwqcu riu ncvc,",Affine
"Wkdw zkhq wkh Eudlqhv zhuh rxw, wkh pdq zrxog gbh,",Caesar
"Jxkp gdux jra Fnqsjuc monu kkd, ddu iqx myqbn tia,",Vigenère
PDRSVYGMPDICMRGAILUGMKMVSZPDLCRAVNMUBZCBIU,Playfair
"T neasrutmwdehtwe h rie eeot h a ol y,ahtBnw ,enud",Rail Fence
"Zriz orcv zrc Npiwvcu ocpc aez, zrc qiv oaelx xyc,",Affine
Dqg wkhuh dq hqg: Exw qrz wkhb ulvh djdlqh,Caesar
Qdn jraho qx uxz: Rkd dys ddui hsou wwkedo,Vigenère
RAKZCFMKRAGMCDZLANZQCFDNSXIMINGAIU,Playfair
Ate :tweiann hr ned u o hyrs giedeanBnt ea,Rail Fence
Ivx zrcpc iv cvx: Nez vao zrcy pwuc imiwvc,Affine
"Zlwk wzhqwb pruwdoo pxuwkhuv rq wkhlu furzqhv,",Caesar
"Mydd dsuxpo iebpqvh wqhddubo yj ddusn mnegjuc,",Vigenère
XGPDQZGMQDONDZMSUCZMPDKMPARQCFKADMNVMGXA,Playfair
"W nmamh trosihtet otl uteso hi rwe,twyrlrrnecn",Rail Fence
"Owzr zocvzy qapzill qepzrcpu av zrcwp spaovcu,",Affine
Dqg sxvk yv iurp rxu vwrrohv. Wklv lv pruh vwudqjh,Caesar
Qdn feox ri bhyi yqh ojykboo. Jxso so wkho idnqxcu,Vigenère
RAHTXLFOPIMNONZMTLAVMPILPDSXSXONMKTLMRYQIU,Playfair
Ap f  o.isrtgn uhv rmorsols hsi oesrnedssouteT m a,Rail Fence
Ivx feur ju hpaq aep uzaalcu. Zrwu wu qapc uzpivmc,Affine
Wkhq vxfk d pxuwkhu lv,Caesar
Jxoj cqsr q ikbpxon so,Vigenère
PDGMLXHYROZMPDKMSX,Playfair
T hmhihnsc  ute seuarr,Rail Fence
Zrcv uesr i qepzrcp wu,Affine
Od. Pb zruwkb Orug,Caesar
Bq. Wi mynjru Pkhn,Vigenère
SMNCVNDZYBPMDK,Playfair
LMoyra ywrh od. tL,Rail Fence
Li. Qy oapzry Lapx,Affine
Brxu Qreoh Iulhqgv gr odfnh brx,Caesar
Oeen Rkrva Jnyojtc ty bkyao oyq,Vigenère
HNZMANCSFGAKGMBTHRSMDEGCMV,Playfair
Y lrdocyorNbeFinsd ak ouo e leu,Rail Fence
Yaep Vanlc Hpwcvxu xa lisgc yae,Affine
Pdfe. L gr irujhw:,Caesar
Cqmx. Y nk pkhqaj:,Vigenère
ORHDKBHPNMIFSZ,Playfair
M.dotab  ofre:cI g,Rail Fence
Qisn. W xa hapmcz:,Affine
"Gr qrw pxvh dw ph pb prvw zruwkb Iulhqgv,",Caesar
"Te jed ceou wj iu io iecp gkhddo Vhsadno,",Vigenère
HRANLRXLIMLRLCCNAPQZNMPDHGAKGMBT,Playfair
"Douae tr e,ontms tm yms otyFins  e mowhrd",Rail Fence
"Xa vaz qeuc iz qc qy qauz oapzry Hpwcvxu,",Affine
"L kdxh d vwudqjh lqiluplwb, zklfk lv qrwklqj",Caesar
"Y rwko q ojbwdqa sjvsncspo, mresr yc dypxsjw",Vigenère
FBMXIMTLMRYQFKOGKAAEQDVYEBBFQARPBFYQ,Playfair
"Iu a itwh h aeasrneifriy hc sntigh tgnm,iion",Rail Fence
"W riec i uzpivmc wvhwpqwzy, orwsr wu vazrwvm",Affine
"Wr wkrvh wkdw nqrz ph. Frph, orxh dqg khdowk wr doo,",Caesar
"Je pxyou pxkp ujeg co. Gkco, vkko qxz raqvpx pe wbv,",Vigenère
PRPDAPKLBOZTANUNLENOLUMVIMRYCFMSPDPRMSSU,Playfair
"Th toeo eda aotoeta nwm.Cm,lu n elht l, shk  eoahtol",Rail Fence
"Za zrauc zriz gvao qc. Saqc, laec ivx rcilzr za ill,",Affine
"Wkhq Loh vlw grzqh: Jlxh ph vrph Zlqh, iloo ixoo:",Caesar
"Jxoj Mhu oyd tysdo: Keko co iyiu Myxa, byvh pqbv:",Vigenère
PDGMESILKSHRNYFIEXLCILNOGUGAFGESPEMUSU,Playfair
"T   nG s eif:hnIestdwe iem oeWn,fl ulelio:uemi ll",Rail Fence
"Zrcv Wlc uwz xaovc: Mwec qc uaqc Owvc, hwll hell:",Affine
Hqwhu Jkrvw.,Caesar
Uddah Wxyoj.,Vigenère
GMLKNKFHTL,Playfair
Erone hs.tGt,Rail Fence
Cvzcp Mrauz.,Affine
"L gulqnh wr wk' jhqhudoo lrb r'wk' zkroh Wdeoh,",Caesar
"Y nnyxgu pe px' wojubwbv yyu y'jr' gdeva Xwrva,",Vigenère
KBAKRGKLRPYFGMKMMSSENHRPYVFHULSRCSIU,Playfair
"Ii tgr  hh l rnet h eealiyot'woeTbedko'nlo' la,",Rail Fence
"W xpwvgc za zr' mcvcpill way a'zr' oralc Zinlc,",Affine
"Dqg wr rxu ghhuh Iulhqg Edqtxr, zkrp zh plvvh:",Caesar
"Qdn jy een nauba Jnyojt Rqxmky, gdew mo csoio:",Vigenère
RAKZAVMVDKIUKMFGAKGMCDRALWNVFHNULCSXLI,Playfair
"Atue eBuw men oordeeFin aqo hmw is:d  rrdn,oes",Rail Fence
"Ivx za aep xccpc Hpwcvx Nivkea, oraq oc qwuuc:",Affine
"Zrxog kh zhuh khhuh: wr doo, dqg klp zh wkluvw,",Caesar
"Meeht du suba rauba: pe wbv, kjt dyw mo jrehcp,",Vigenère
VNMUCYGUKMFCIUKMKLNRSUSMRYBFNUKLBFATSZ,Playfair
"Wd ee a   tsol ewr er:t l,adhmw hrtuheheolniei,",Rail Fence
"Oaelx rc ocpc rccpc: za ill, ivx rwq oc zrwpuz,",Affine
Dqg doo wr doo,Caesar
Qdn qvh dk khb,Vigenère
RABRSUPLNRSUSU,Playfair
Aatln l oaldl ,Rail Fence
Ivx ill za ill,Affine
"Orugv. Rxu gxwlhv, dqg wkh sohgjh",Caesar
"Bebzi. Yen nqjsai, qxz ddu lbozwo",Vigenère
PMDKPAZMCZSKILRAKZCFQPKCIF,Playfair
"Lsuusnhleod.Ordte,adtepegr  i   d",Rail Fence
"Lapxu. Aep xezwcu, ivx zrc flcxmc",Affine
"Pdf. Dxdqw, & txlw pb vljkw, ohw wkh hduwk klgh wkhh:",Caesar
"Cqm. Eqqxp, & aqyd ci iscxd, vaj pxo uknjr xszu pxoa:",Vigenère
ORBMXMRQLWKSNCXSFYLPKLPDIUIMDZBVBFCKPDIUIU,Playfair
"M n&iyg   tit:a.Aat  utm ih,ltteerhhd hecu,q steha ee",Rail Fence
"Qis. Ieivz, & kewz qy uwmrz, lcz zrc cipzr rwxc zrcc:",Affine
"Wkb erqhv duh pduurzohvvh, wkb eorrg lv frog:",Caesar
"Jxi ryjuc qba wwhbkmvaica, pxi rvken yc syht:",Vigenère
PDBDNAILRMLCRMMNUQILLIPDBDPMRHSXHMTC,Playfair
"Tbserlehl c:h oe r arwes,tybodi odynamos  osl",Rail Fence
"Zry navcu ipc qippaolcuuc, zry nlaax wu salx:",Affine
Wkrx kdvw qr vshfxodwlrq lq wkrvh hbhv,Caesar
Jxyq rwid dy izasehqdeex yx jrkio uiai,Vigenère
PDMVBOTLANTQLEMURSFAAGRQFHLIGCIL,Playfair
T t ct teehuhs oseuaini hs ysoanplonoe,Rail Fence
Zrae riuz va ufcselizwav wv zrauc cycu,Affine
Zklfk wkrx grvw joduh zlwk,Caesar
Mxsyx pxyq nkid wvwho mspx,Vigenère
VYEBDPFHZCAPQKSMMKXGPD,Playfair
Whoogethc huds lr ihit taw,Rail Fence
Orwsr zrae xauz mlipc owzr,Affine
Od. Wklqnh ri wklv jrrg Shhuhv,Caesar
Bq. Dredua yb ddyc wykt Fuonuc,Vigenère
SMPDGAEFHPPDSXFNRHLFKMIL,Playfair
LTkfioPea hneo hsgo ers.i t de,Rail Fence
Li. Zrwvgc ah zrwu maax Fccpcu,Affine
"Exw dv d wklqj ri Fxvwrph: 'Wlv qr rwkhu,",Caesar
"Rkd qc q pxsjw kv Skcpewa: 'Dso xk ypxon,",Vigenère
CXSRXBPDGAFNEHXLPRCLSKQAAVRPCFAZ,Playfair
"Ba nfseTnt,u satigo utm:'i oohrt h Co s e",Rail Fence
"Nez iu i zrwvm ah Seuzaqc: 'Zwu va azrcp,",Affine
Rqhob lw vsrbohv wkh sohdvxuh ri wkh wlph,Caesar
Edoho ej ofyuboo ddu lbowienu kv pxo jsiu,Vigenère
NALUBGLTVHCQILPDFLULBXZMFMKPCFSKCL,Playfair
Oy y  ae  enl tsolstepesr ftetmeipehluohi,Rail Fence
Avcly wz ufaylcu zrc flciuepc ah zrc zwqc,Affine
"Pdfe. Zkdw pdq gduh, L gduh:",Caesar
"Cqmx. Mxkp wwd zqba, Y nwho:",Vigenère
ORHDVYRSORRYRMFKBRMK,Playfair
"M.aaa aab htmndr,Idr:cW  e e",Rail Fence
"Qisn. Oriz qiv xipc, W xipc:",Affine
"Dssurdfk wkrx olnh wkh uxjjhg Uxvvldq Ehduh,",Caesar
"Qfznekyx pxyq veao jra bqwqat Hkcoykj Faqba,",Vigenère
OSTONRHYPDMVSEEFPDKMWEIFKDXLXSRACIRMIU,Playfair
"Ao ukhudsnaprahto ieterge usa er,pchl  gRiBe",Rail Fence
"Iffpaisr zrae lwgc zrc pemmcx Peuuwiv Ncipc,",Affine
"Wkh dup'g Uklqrfhurv, ru wk' Klufdq Wljhu,",Caesar
"Jxo qbi'n Bredyyubki, eb jr' Lehmwd Jyqah,",Vigenère
PDIMMOKDBFANELMNPADZBVBFMDRASKIFAZ,Playfair
"Tadie,  cTrh r' hncrs rt'Hra ie,emRooohing",Rail Fence
"Zrc ipq'x Prwvascpau, ap zr' Rwpsiv Zwmcp,",Affine
"Wdnh dqb vkdsh exw wkdw, dqg pb iluph Qhuxhv",Caesar
"Jqua kjo oxklu xkd jrwj, qxz wu pehwa Raheai",Vigenère
SREFRABQBOLFCXSZPDRSRACRHGKACLMGMZIL,Playfair
"T  puh  feraeaysaebtta,adm im eusknh  tnyrNe",Rail Fence
"Zigc ivy urifc nez zriz, ivx qy hwpqc Vcpecu",Affine
"Vkdoo qhxhu wuhpeoh. Ru eh dolxh djdlqh,",Caesar
"Ixkhb jueah phoirva. Eh xu wbsqu wwkedo,",Vigenère
PBMSQMLMKMZDLCCSFMADIMSEMLNIBSMG,Playfair
"Slutb bl ihl ee rml.O eaieaan,anreer uge",Rail Fence
"Urill vcecp zpcqnlc. Ap nc ilwec imiwvc,",Affine
Dqg gduh ph wr wkh Ghvduw zlwk wkb Vzrug:,Caesar
Qdn tknu iu pe pxo Nooqbp gejr jru Wsebz:,Vigenère
RABZBRMKCLPRPDKCILRMQZKSDPYBQXNMBZ,Playfair
Ad thetthw:n aem oteDsr ihtySoddre  aw  r,Rail Fence
Ivx xipc qc za zrc Xcuipz owzr zry Uoapx:,Affine
"Li wuhpeolqj L lqkdelw wkhq, surwhvw phh",Caesar
"Yv phoirvedq S edrwrsp ddux, znedaid coa",Vigenère
KGZDLCCSGAIKGABOISSZPDGMTORPILLRIUIU,Playfair
"Irl nih t ftebigIihbtte,poetme mn a nrse",Rail Fence
"Wh zpcqnlwvm W wvrinwz zrcv, fpazcuz qcc",Affine
"Wkh Edeb ri d Jluoh. Khqfh kruuleoh vkdgrz,",Caesar
"Jxo Lkxo kv w Kehva. Xuxyu debnylhu oxkzeg,",Vigenère
PDICBIHNIOIKMTFCGMELFHAZAKCSILBOHRXZ,Playfair
"TB ar cobsoh ayo  il.Hnehril hdwebfGee rea,",Rail Fence
"Zrc Niny ah i Mwplc. Rcvsc rappwnlc urixao,",Affine
"Yquhdoo prfn'ub khqfh. Zkb vr, ehlqj jrqh",Caesar
"Ldbaqvh wksu'hi xojso. Ado oe, roedq wyju",Vigenère
WOMKMSUCMHTDBYGMELVYBQAHFKYQFNMG,Playfair
"Vam'hehoe enel okr ec.Wys,biggnrlcyn   no",Rail Fence
"Jvpcill qasg'py rcvsc. Ory ua, ncwvm mavc",Affine
L dp d pdq djdlqh: sudb brx vlw vwloo,Caesar
Y ki k ckj kcqsju: fbwo uee isp cpyvh,Vigenère
SBORORARINGAFLMRBWHNXLKSTLESSU,Playfair
I ageryssl mamnaan:pa o i tla  i yuti,Rail Fence
W iq i qiv imiwvc: fpiy yae uwz uzwll,Affine
"Od. Brx kdxh glvsodf'g wkh pluwk,",Caesar
"Bq. Iyq rwko tsofvws'z ddu iybpx,",Vigenère
SMHNVCMXKCSXQPMBKZCFAEDZBV,Playfair
"LYh p'hi,a o aedslcdtemrh.uuia  t",Rail Fence
"Li. Yae riec xwuflis'x zrc qwpzr,",Affine
"Eurnh wkh jrrg phhwlqj, zlwk prvw dgplu'g glvrughu",Caesar
"Rhygu pxo wykt iuopyxc, sydd wkid qniyb't zyckhnah",Vigenère
DARFKLCFFNRHCLKLGAQNKSCOAPSRCRKABZBKPADKKM,Playfair
"Beeoenw tmdserk h odmeig ihms di' iodrotg t,toardr",Rail Fence
"Npagc zrc maax qcczwvm, owzr qauz ixqwp'x xwuapxcp",Affine
"Pdfe. Fdq vxfk wklqjv eh,",Caesar
"Cqmx. Sqx ieyx pxsjwc ro,",Vigenère
ORHDBMAQMEDPBFYQXIIU,Playfair
"M.nchs,ab a uhtig ecCs nb",Rail Fence
"Qisn. Siv uesr zrwvmu nc,",Affine
"Dqg rxhufrph yv olnh d Vxpphuv Forzg,",Caesar
"Qdn eeahmkco lc bsgu w Wqcwahc Mvkmn,",Vigenère
RAHRMLMDNOFUTPKEIMLXAUCLATEUNVBZ,Playfair
"Aoc l url,n uroev ieaSmesCoddemsk m w",Rail Fence
"Ivx aecpsaqc ju lwgc i Ueqqcpu Slaox,",Affine
Zlwkrxw rxu vshfldoo zrqghu? Brx pdnh ph vwudqjh,Caesar
Myddeep yqh ofoyykhb sexzub? Ckk iqua wa cphkjwo,Vigenère
XGPDMVPRZMTQLESBSUQUNACKNDMVOREFCLTLMRYQIU,Playfair
Woosi d  e aihu u pcalwne?Yumk esrnettreloroamtg,Rail Fence
Owzraez aep ufcswill oavxcp? Yae qigc qc uzpivmc,Affine
"Hxhq wr wkh glvsrvlwlrq wkdw L rzh,",Caesar
"Ukoj dk ddu zyclecejskd pxkp M ega,",Vigenère
LMGMPRPDKCSXVHXSSKNAPDRSFAUG,Playfair
"E tdoit wunt h ipsto htIoeeoesina ,",Rail Fence
"Cecv za zrc xwufauwzwav zriz W aoc,",Affine
"Zkhq qrz L wklqnh brx fdq ehkrog vxfk vljkwv,",Caesar
"Mxoj xkm Y ddyxgu uee skj laxyht okmd cewrpi,",Vigenère
VYGMANXGPDGAEFHNMERACIFHTCLXHYXSFYLT,Playfair
"W  heunh hg,hnnwItik o a eodsc ihseo nycblust",Rail Fence
"Orcv vao W zrwvgc yae siv ncralx uesr uwmrzu,",Affine
"Dqg nhhsh wkh qdwxudoo Uxelh ri brxu Fkhhnhv,",Caesar
"Qdn aoafo jra xwjenqvh Vqrsa yb ikkb Mrauuai,",Vigenère
RAKTIUFLKLCFARLZMRSUTMXCKFHPHNZMHYIUFEIL,Playfair
"Akeetlu y e,n ep h aualRbeo orCeksdetnr ifuhe",Rail Fence
"Ivx gccfc zrc vizepill Penwc ah yaep Srccgcu,",Affine
Zkhq plqh lv eodqfk'g zlwk ihduh,Caesar
Mxoj wedo yc rvwdmd'n mspx buknu,Vigenère
VYGMAEMGSXCSRAHYYZKSFPIMMK,Playfair
W e ndtehnmn sbac' ihfaeeiilhw r,Rail Fence
Orcv qwvc wu nlivsr'x owzr hcipc,Affine
"Urvvh. Zkdw vljkwv, pb Orug?",Caesar
"Hecou. Grwj oyqdjc, wu Pkhn?",Vigenère
MNXALIVYRSXSFYLTNCPMDK,Playfair
"Rehstmoos.Wa ihs yLr?s tg, d",Rail Fence
"Pauuc. Oriz uwmrzu, qy Lapx?",Affine
Od. L sudb brx vshdnh qrw: kh jurzhv zruvh & zruvh,Caesar
Bq. S lhku ikk ofowao dyp: du chysuc mynio & sebou,Vigenère
SMFSMRBWHNXLLFRIGMRPCFKNNVILVNATGUNMLI,Playfair
LIaopeteo s sa  ryyusek o:h rwswre&wre.p  an geo o,Rail Fence
Li. W fpiy yae ufcigc vaz: rc mpaocu oapuc & oapuc,Affine
"Txhvwlrq hqudjhv klp: dw rqfh, jrrgqljkw.",Caesar
"Gkoojskd adbwwoo rec: qd exyu, wyktxewrp.",Vigenère
LWILSKNAGMMRIFPBEARSNAELFNRHAGFYSZ,Playfair
"Qt a : eoi.usinergshm toc,gongteoneian dh",Rail Fence
"Kecuzwav cvpimcu rwq: iz avsc, maaxvwmrz.",Affine
"Vwdqg qrw ysrq wkh rughu ri brxu jrlqj,",Caesar
"Ijkjt jed lzkd pxo ebzub ep oyqh cesjw,",Vigenère
TLRAYRRPOVNAPDFMDKKMHPHNZMFNGAIW,Playfair
"Sdtohr y ntn o pnteodro orgiganv  efuo,",Rail Fence
"Uzivx vaz jfav zrc apxcp ah yaep mawvm,",Affine
Exw jr dw rqfh,Caesar
Rkd wy qd exyu,Vigenère
CXQKNRPRMYIU,Playfair
Bgtcu oa net o,Rail Fence
Nez ma iz avsc,Affine
"Ohq. Jrrg qljkw, dqg ehwwhu khdowk",Caesar
"Bux. Kken dscxd, kjt xudpub xowbdd",Vigenère
ULYQAVRHAGFYSRRYCISZLKODIMPLBV,Playfair
"L dg  thte.Go ih,adbte elhnontnera",Rail Fence
"Lcv. Maax vwmrz, ivx nczzcp rcilzr",Affine
Dwwhqg klv Pdlhvwb,Caesar
Qjdadn xso Qwyooji,Vigenère
RSLKRYBFLABSILQD,Playfair
AniattedhsMisyt  e,Rail Fence
Izzcvx rwu Qiwcuzy,Affine
Od. D nlqgh jrrgqljkw wr doo.,Caesar
Bq. K gyxzu ceyzdscxd jy qvh.,Vigenère
SMRIGACKFNRHAGFYSZPRMSSU,Playfair
LAngnt .a  id odih oal.keogtl,Rail Fence
Li. I gwvxc maaxvwmrz za ill.,Affine
Halw Orugv.,Caesar
Unsp Pkhno.,Vigenère
IUKSPMDKXA,Playfair
E dxtLrsio.,Rail Fence
Ctwz Lapxu.,Affine
Pdfe. Lw zloo kdxh eorrg wkhb vdb:,Caesar
Cqmx. Yj syvh rwko rvken jrao oqi:,Vigenère
ORHDKSXGSUPCMXICPMRHPDGCXBBW,Playfair
M. lul yyab twl aebodte a:cIih ohs,Rail Fence
Qisn. Wz owll riec nlaax zrcy uiy:,Affine
Eorrg zloo kdxh Eorrg:,Caesar
Rbykt syvh rwko Lvken:,Vigenère
CSAVRHXGSUPCMXICPMRH,Playfair
BdlaBdlo ilhu lo:ow eo,Rail Fence
Nlaax owll riec Nlaax:,Affine
"Vwrqhv kdxh ehhqh nqrzqh wr prxh, & Wuhhv wr vshdnh:",Caesar
"Ijyjuc xkqu xuoju gdysdo jy cyqu, & Jhoai pe ofowao:",Vigenère
TLNAILBOMLCIGMFEANNYKLNOMVKLMKILPRTQIMEF,Playfair
"Seabeo m,Ts atnshu en nwet oe  re osek:o eeknou&etpe",Rail Fence
"Uzavcu riec nccvc gvaovc za qaec, & Zpccu za ufcigc:",Affine
"Dxjxuhv, dqg yqghuvwrrg Uhodwlrqv, kdxh",Caesar
"Qkqqhoo, wdn lxzubojykt Huvwjskdc, rwko",Vigenère
MXEWMKXBRYWOCKATPRRHMKSMSKNAPBMXIU,Playfair
"Ar  eoRtsauue,advdrto eain,hugsnnsdlo e",Rail Fence
"Iemepcu, ivx jvxcpuzaax Pclizwavu, riec",Affine
"Eb Pdjjrw Sbhv, & Fkrxjkhv, & Urrnhv eurxjkw iruwk",Caesar
"Ro Cqqced Ziai, & Sxyqwrai, & Heyguc rbkkqdj bebpx",Vigenère
DBORIWFNLQCGLBFHWECFTAAVRFILDAMVFYPKNMPD,Playfair
"Bate&oe&o u tyMgo ys  huhs  oksbogtfrh gP,Cg,Rerho",Rail Fence
"Ny Qimmaz Fycu, & Sraemrcu, & Paagcu npaemrz hapzr",Affine
Wkh vhfuhw'vw pdq ri Eorrg. Zkdw lv wkh qljkw?,Caesar
Jxo ioyhop'cp wwd kv Rbykt. Grwj ei pxo dscxd?,Vigenère
PDILLEMKLTLRRAHPCSAVRHVYRSSXPDGMKIDP,Playfair
Tsetn oW tnth erts a fBod hti h ih?ec'mol.aseg,Rail Fence
Zrc ucspcz'uz qiv ah Nlaax. Oriz wu zrc vwmrz?,Affine
"Od. Doprvw dw rgghv zlwk pruqlqj, zklfk lv zklfk",Caesar
"Bq. Kviecp kp yztoo gejr cyndsjw, mresr yc mresr",Vigenère
SMMSONTLRSRHCKQXKSCONMAGYQVYEBBFQXBFHY,Playfair
"LAstdw n,iiha lota de ihmrig hc swih.m ostonwh c",Rail Fence
"Li. Ilqauz iz axxcu owzr qapvwvm, orwsr wu orwsr",Affine
Pdfe. Krz vdb'vw wkrx wkdw Pdfgxii ghqlhv klv shuvrq,Caesar
Cqmx. Xeg iku'cp ddee jrwj Cqmzkpb nadsai dyc foniyj,Vigenère
ORHDFHXQNBTLPDMVPDRSORHCVEKHGMKFPBSXLFATNA,Playfair
M.wy uaafessrab o a'tto htMcufdne i esncHssht d ihpo,Rail Fence
Qisn. Rao uiy'uz zrae zriz Qisxehh xcvwcu rwu fcpuav,Affine
Dw rxu juhdw elgglqj,Caesar
Qj kkb wbaqd rsztsjw,Vigenère
RSMVNKMKRSISBZBKYQ,Playfair
Aur dtorgetbdig  ain,Rail Fence
Iz aep mpciz nwxxwvm,Affine
Od. Glg brx vhqg wr klp Vlu?,Caesar
Bq. Nsz ikk ouxz dk rec Iyb?,Vigenère
SMBKCBMVLIRYPRBFALKA,Playfair
LDys hSa i o edt i i?.dunomr,Rail Fence
Li. Xwx yae ucvx za rwq Uwp?,Affine
Pdfe. L khduh lw eb wkh zdb: Exw L zloo vhqg:,Caesar
Cqmx. Y raqba sp lu ddu sqi: Fqj Y gebv iojt:,Vigenère
ORHDFBIMMKKSDBPDGUNBCXSKXGSUPTGMBZ,Playfair
M.he tw  is:ab  er tb h a:BtIwl edcIaiyeyu ln,Rail Fence
Qisn. W rcipc wz ny zrc oiy: Nez W owll ucvx:,Affine
Wkhuh'v qrw d rqh ri wkhp exw lq klv krxvh,Caesar
Jxonu'o xkj w yju kv pxoi lqj ed dyc xyqio,Vigenère
PDKMILANSRNAFMKPCFACZLGABFPBMVLI,Playfair
Tenae mt  shr' o  n fte u nhshueestoohbiio,Rail Fence
Zrcpc'u vaz i avc ah zrcq nez wv rwu raeuc,Affine
L nhhsh d Vhuxdqw Ihhg. L zloo wr pruurz,Caesar
Y uauza k Conkkjj Vuoz. Y gebv jy cynhys,Vigenère
KEIUFLIMLIMZRAPKIUKCGXESPLNONMMNXZ,Playfair
IearteIlor ep  eun ed  ilt orwkeSaF.w mo,Rail Fence
W gccfc i Ucpeivz Hccx. W owll za qappao,Affine
(Dqg ehwlphv L zloo) wr wkh zhbdug Vlvwhuv.,Caesar
(Kxz lajsiuc S syvh) pe pxo mouqbz Weidahc.,Vigenère
RACDKLEAILGXESPLRPCFUGBNDKXSTLKMXA,Playfair
( i i twrirAdbtmsIwl)t h eadSsesnee loey t.,Rail Fence
(Ivx nczwqcu W owll) za zrc ocyipx Uwuzcpu.,Affine
Pruh vkdoo wkhb vshdnh: iru qrz L dp ehqw wr nqrz,Caesar
Ceba cdqvh ddui izaqua: beb dys M qw rojj pe gdys,Vigenère
ONMKPBMSPLCFBQLFRIFGNMANXGROCIRQPRGRNV,Playfair
M lhskfnI t woesalte pae o o  mbn okorh ye:rwaetn,Rail Fence
Qapc urill zrcy ufcigc: hap vao W iq ncvz za gvao,Affine
"Eb wkh zruvw phdqhv, wkh zruvw, iru plqh rzqh jrrg,",Caesar
"Ro pxo mynid cowdoo, pxo mynid, pkh iyxa ysdo wykt,",Vigenère
DBPDGUNMTLCLRAILPDGUNMTLPHMOGAFMNYFIAVRH,Playfair
"Bho n  sfm eoytewrtmae,tewrt o ieon od  sesho,rnwg,",Rail Fence
"Ny zrc oapuz qcivcu, zrc oapuz, hap qwvc aovc maax,",Affine
Doo fdxvhv vkdoo jlxh zdb. L dp lq eorrg,Caesar
Qbv skqioo cdqvh qeko mku. Y ki sj lheyz,Vigenère
MSUEMXLIXAPBMSQEEXGUNBSBAEAYPMRH,Playfair
Aceh ey ill asssalgu a.Ia nbodlu liw m o,Rail Fence
Ill sieucu urill mwec oiy. W iq wv nlaax,Affine
"Vwhsw lq vr iduuh, wkdw vkrxog L zdgh qr pruh,",Caesar
"Ijolj ed oe bqbnu, jrwj oxyqbn S sqna xk wkho,",Vigenère
TLFLSKAQHPRMMKPDRSPBMVTCGXRBGMNONMIU,Playfair
"St fehsl e etp ns ar,ta hudIwd omr,eior to ano",Rail Fence
"Uzcfz wv ua hippc, zriz uraelx W oixc va qapc,",Affine
Uhwxuqlqj zhuh dv whglrxv dv jr ruh:,Caesar
Hudqhxedq monu wi puneeeo ko qk ynu:,Vigenère
MKLZMAGAQNKMIMTLKCFAXLBXFNNMIU,Playfair
Rrgrsds oeunn eea eiu sg r:tiw toaoe,Rail Fence
Pczepvwvm ocpc iu zcxwaeu iu ma apc:,Affine
"Vwudqjh wklqjv L kdxh lq khdg, wkdw zloo wr kdqg,",Caesar
"Ijbwdqa ddyxci Y rwko yx xowt, jrwj syvh dk rwdn,",Vigenère
TLMRYQKLBFYQXSBOMLGACFRBPDRSXGSUPLHFRABZ,Playfair
"Sntg e dhw h,tag hnsIhu nha,ta ilt adrei aie tlon",Rail Fence
"Uzpivmc zrwvmu W riec wv rcix, zriz owll za rivx,",Affine
"Zklfk pxvw eh dfwhg, huh wkhb pdb eh vfdqg",Caesar
"Mxsyx ikcp la kyjoz, aho jrao iqi ro imwdn",Vigenère
VYEBCOXLSDIMDLKCKMKLCFCNNBCILBRABZ,Playfair
"Whset  yy nhc utb ce,eete a esadim adrhmbc",Rail Fence
"Orwsr qeuz nc iszcx, cpc zrcy qiy nc usivx",Affine
"Od. Brx odfnh wkh vhdvrq ri doo Qdwxuhv, vohhsh",Caesar
"Bq. Iyq vwsua ddu oukoex ep qvh Rwjenuc, chuolu",Vigenère
SMHNMUMBEFPDILIMPAANIOSUQMRSZMILTPIUFLIU,Playfair
"LYleea aNr ea o ak h esno l aue,sep.uctsofltsle",Rail Fence
"Li. Yae lisgc zrc uciuav ah ill Vizepcu, ulccfc",Affine
"Pdfe. Frph, zhh'o wr vohhsh: Pb vwudqjh & vhoi-dexvh",Caesar
"Cqmx. Sewa, suo'b pe oboafo: Qu cphkjwo & ouvb-kxkca",Vigenère
ORHDHMCLUGLUPRTPIUFLLCBQZDRAIFLIPEBIXLIU,Playfair
"M.mwl e sn&lbab oe e' osep:M tag  efauecC,etleyres-s",Rail Fence
"Qisn. Saqc, occ'l za ulccfc: Qy uzpivmc & uclh-ineuc",Affine
"Lv wkh lqlwldwh ihduh, wkdw zdqwv kdug yvh:",Caesar
"Yi pxo yxejswjo vowho, ddqd mkjjc xknt rio:",Vigenère
SXPDFKAGSKRSFGIMMKPDRSXNRQPBRMHZLI,Playfair
"Ihnafehwsrssteiiit er,ta at adve  tea tnh :",Rail Fence
"Wu zrc wvwzwizc hcipc, zriz oivzu ripx juc:",Affine
Zh duh bhw exw brqj lqghhg.,Caesar
Mu who oop lqj uexc sjtoat.,Vigenère
UGRMGCKLCXQDNAIKRYIUKC,Playfair
Wreuoieeaeytbtyn ned    gd.,Rail Fence
Oc ipc ycz nez yavm wvxccx.,Affine
Hahxqw.,Caesar
Unoqdd.,Vigenère
IULMRQ,Playfair
Enxute.,Rail Fence
Ctcevz.,Affine
Vfhqd Txlqwd.,Caesar
Isojq Gksjjk.,Vigenère
LBGMNSXERQBA,Playfair
Sai.cn unaeQt,Rail Fence
Uscvi Kewvzi.,Affine
"Wkxqghu. Hqwhu wkh wkuhh Zlwfkhv, phhwlqj Khfdw.",Caesar
"Jxejton. Uddah pxo jrnuo Gspsrai, coajsjw Xumwj.",Vigenère
