Encrypted_Text,Cipher_Type
"Ev debnyn Rohb, skj mkco q Tyeabv cynu zqwj'n",Vigenère
HPFHAZAKCYLUUERAHMCLRBEXLUUCNMKCRORY,Playfair
"Oodlcc ilradfhri el a oeaDul oedm' rH,nm em n",Rail Fence
"Ah rappwx Rcll, siv saqc i Xwecll qapc xiqv'x",Affine
"Lq hxlov, wr wrs Pdfehwk",Caesar
"Yd akshi, jy jyl Qwslajr",Vigenère
GALMESTLRPHVORHDKLBV,Playfair
"Iu,  bneis otpMceh ltoat",Rail Fence
"Wv cewlu, za zaf Qisnczr",Affine
"Pdo. L judqw klp Eorrgb,",Caesar
"Cqv. M wbwdd xsi Fheyzo,",Vigenère
ORSEKNRAPDEACSAVRHBW,Playfair
"M r  oa.IgathmBod,l nily",Rail Fence
"Qil. W mpivz rwq Nlaaxy,",Affine
"Oxaxulrxv, Dxdulflrxv, Idovh, Ghfhlwixoo,",Caesar
"Bkhqhskkc, Eqqbesskkc, Jwbca, Tumaydbkvh,",Vigenère
UMZVAKMVXBXMAKBEMVPIMSLICKELKSEVSUSU,Playfair
"Lrsucsa,cf,uuiu,Aaiiu,Fle eetulxo ro sDil",Rail Fence
"Letepwaeu, Ieipwswaeu, Hiluc, Xcscwzhell,",Affine
"Vrgdlqh, Pdolflrxv, vpdfnlqj ri hxhub vlqqh",Caesar
"Ienwyxa, Cqvesskkc, ciqmgyxc yb oqubu cedxa",Vigenère
PABRGALCMSEBFAXLLAMBEKYQHPLMKMBQGAMG,Playfair
"Si iusk eynoan,Mlcos mcigo ur indeai,anfese",Rail Fence
"Uaxiwvc, Qilwswaeu, uqisgwvm ah cecpy uwvvc",Affine
"Wkdw kd'v d qdph. Exw wkhuh'v qr erwwrph, qrqh",Caesar
"Jxkp rw'c q jqwa. Rkd jraho'i je xedpewa, jexa",Vigenère
PDRSBOXBARCLCXSZPDKMILANHASZPRCLANMG,Playfair
"T sn.tes t,nhth'  ae u hr' obtoe oeaaamBtenomn",Rail Fence
"Zriz ri'u i viqc. Nez zrcpc'u va nazzaqc, vavc",Affine
"Lq pb Yroxswxrxvqhvvh: Brxu Zlxhv, brxu Gdxjkwhuv,",Caesar
"Yd io Levqfdqeeodooio: Ckkb Gsquc, ikkb Nkqwrpubo,",Vigenère
GANCOHUMQLVMXLMGXALIHNZMXGMLQBMVDKMXFYLKAT,Playfair
"IyluneoWsoDhsnm outoses:Yu ie,yu agtr, Vpus ru rue",Rail Fence
"Wv qy Jalefzeaeuvcuuc: Yaep Owecu, yaep Xiemrzcpu,",Affine
"Brxu Pdwurqv, dqg brxu Pdlghv, frxog qrw iloo ys",Caesar
"Oeen Qwjbkdc, kjt ueen Qwynai, syqbn dyp pebv lz",Vigenère
HNZMORZDNAXBRYHNZMORKBILHMMUYRRPGKSUPUSV,Playfair
"Y r,duaso  lorMtos n orMie,cudntfl puanay d loiv",Rail Fence
"Yaep Qizpavu, ivx yaep Qiwxcu, saelx vaz hwll jf",Affine
"Wkh Fhvwhuqh ri pb Oxvw, dqg pb Ghvluh",Caesar
"Jxo Moojondo ep ci Veoj, qxz wu Haisnu",Vigenère
PDLEILLKMAFMEOCQXLSRRYNCCKXSMK,Playfair
"TCe mu  Drh etreo yLs,adm eieesnf tnys",Rail Fence
"Zrc Scuzcpvc ah qy Leuz, ivx qy Xcuwpc",Affine
Doo frqwlqhqw Lpshglphqwv zrxog ruh-ehduh,Caesar
Qbv syjjsjuxp Mifozywaddo gkkvz ynu-xuknu,Vigenère
MSUENASKMGRQEALFBKCLRQQXMVTCNMICIMMK,Playfair
Acitpmsuobel otnn meiet ol r-erlneIdnwdea,Rail Fence
Ill savzwvcvz Wqfcxwqcvzu oaelx apc-ncipc,Affine
"Wkdw glg rssrvh pb zloo. Ehwwhu Pdfehwk,",Caesar
"Jxkp net kfzkio ci mshb. Lopjon Qwslajr,",Vigenère
PDRSBKHRSVVHLINCXGSUSCKLLKMOMBCIPD,Playfair
"T  omi tMehtddops ywl.Bte abt,aipe lerch",Rail Fence
"Zriz xwx affauc qy owll. Nczzcp Qisnczr,",Affine
Wkhq vxfk dq rqh wr uhljqh,Caesar
Jxoj cqsr qx exa dk bayqju,Vigenère
PDGMLXHYRANAKLNMFKQYIU,Playfair
T h  rnhnsc noet egeeuanoi,Rail Fence
Zrcv uesr iv avc za pcwmvc,Affine
Pdfg. Erxqgohvvh lqwhpshudqfh,Caesar
Cqmz. Reejtvaica sjjoifonqxyu,Vigenère
ORHCHAWMCTILLIGALKOLKMRAEL,Playfair
M.ue eread onlseitmeaccBdsnpn,Rail Fence
Qisx. Naevxlcuuc wvzcqfcpivsc,Affine
Lq Qdwxuh lv d Wbudqqb: Lw kdwk ehhqh,Caesar
Yd Dqdqho yc q Jobwdxu: Yj dqdd lauxa,Vigenère
GAARLZMKSXRSDNRAYGKSBOPDCIGMIU,Playfair
Iae ynIabenNtr saTrny tht en ui a: he,Rail Fence
Wv Vizepc wu i Zypivvy: Wz rizr nccvc,Affine
"Wk' yqwlphob hpswblqj ri wkh kdssb Wkurqh,",Caesar
"Jx' lxpywabi uwljiedq ep jra rwfzu Xdhyju,",Vigenère
PDWOSKCLQCLCQLBGYQHPPDFCOSQHPDMNMG,Playfair
"Tvm tg  pheh nieyepyn ftehpyTrn,'tlmioha o",Rail Fence
"Zr' jvzwqcly cqfzywvm ah zrc riffy Zrpavc,",Affine
Dqg idoo ri pdqb Nlqjv. Exw ihduh qrw bhw,Caesar
Qdn vkhb kv iqxu Oedqo. Rkd vowho dyp iaj,Vigenère
RAHKMSPMEORADGGAIQCXPKIMMKANQDKL,Playfair
Af m gBfettn alo ayKns u er o edlfni.tany,Rail Fence
Ivx hill ah qivy Gwvmu. Nez hcipc vaz ycz,Affine
Wr wdnh ysrq brx zkdw lv brxuv: brx pdb,Caesar
Je pqua flex oyq gdqd yc oyqhc: ikk iqi,Vigenère
PRSREFOVNAHNVXBOSKQBMVATHNMCNB,Playfair
Tav  t rymotk pnyuwa syus o a eoohio:uy,Rail Fence
Za zigc jfav yae oriz wu yaepu: yae qiy,Affine
"Frqxhb brxu sohdvxuhv lq d vsdflrxv sohqwb,",Caesar
"Sexqui oyqh lbowienuc yx q ofkyyyqi lbojji,",Vigenère
HMMWGCHNZMQPIMLXMKXSARTQMBFAXLQPGMQD,Playfair
"Ceopss poptouyyu laue nasaiu lnyn reri cse,",Rail Fence
"Savecy yaep flciuepcu wv i ufiswaeu flcvzy,",Affine
Dqg bhw vhhph frog. Wkh wlph brx pdb vr krrgzlqnh:,Caesar
Qdn oop cauwa mkbn. Xdu pywa ikk iqi iy xyktgedua:,Vigenère
RACBKLLILCLEMPKZCFSKCLHNMCNBPAFHRHXGRGIU,Playfair
AyselTt   hwen e em od h ieyumys odik:dtec.emoaoon,Rail Fence
Ivx ycz uccqc salx. Zrc zwqc yae qiy ua raaxowvgc:,Affine
Zh kdxh zloolqj Gdphv hqrxjk: wkhuh fdqqrw eh,Caesar
Mu dqea gebvedq Nkiuc uxkkqd: pxonu yqxjed ro,Vigenère
UGBOMLXGSUSEYQBRCLLIANWEDPCFMKBMAWANSDIU,Playfair
WawiDso:ecoeehu iln ae nuh hr antb elgmegten ,Rail Fence
Oc riec owllwvm Xiqcu cvaemr: zrcpc sivvaz nc,Affine
"Wkdw Yxowxuh lq brx, wr ghxrxuh vr pdqb",Caesar
"Jxkp Zqbdqho yx oyq, pe zuekkba ck wwdi",Vigenère
PDRSWVPLZMFKYGMVPRCKVMZMILNORABW,Playfair
"T t y dusahtVluei o,t eor omnaurnuoue y",Rail Fence
"Zriz Jelzepc wv yae, za xceaepc ua qivy",Affine
"Dv zloo wr Juhdwqhvvh ghglfdwh wkhpvhoxhv,",Caesar
"Qi syvh dk Knukpdooio tozymwjo jraccabeai,",Vigenère
BXXGSUPLNFMKRSMGXALICKBKBMLKPDLCLIUMIL,Playfair
"Aitrnedthesswl oGetes eiaetesle, l asdc mu",Rail Fence
"Iu owll za Mpcizvcuuc xcxwsizc zrcquclecu,",Affine
Ilqglqj lw vr lqfolqgh,Caesar
Vyxzyxc sp ck sjsvedna,Vigenère
GKRYGAIKLTAFMYSERYIU,Playfair
Fiiocdidn ts nlneng ii,Rail Fence
Hwvxwvm wz ua wvslwvxc,Affine
"Pdo. Zlwk wklv, wkhuh jurzhv",Caesar
"Cqv. Aejr jrei, jraho wbkmoo",Vigenère
ORQUKSDPBFTLCFMKKNNVIL,Playfair
"M hiteoa.Wt hs hr rwslit,ege",Rail Fence
"Qil. Owzr zrwu, zrcpc mpaocu",Affine
"Lq pb prvw loo-frpsrvg Diihfwlrq, vxfk",Caesar
"Yd io iecp shb-yewlecz Ebvoyjskd, ieyx",Vigenère
GANCONTLESUENOVHTBOIGFDLFAAQMEBV,Playfair
"Iyslosft,cnm otilcmodAfcin uh m -p eos",Rail Fence
"Wv qy qauz wll-saqfaux Ihhcszwav, uesr",Affine
"D vwdqfkohvvh Dxdulfh, wkdw zhuh L Nlqj,",Caesar
"Q cpqxyxvaica Eqqbeso, ddqd monu Y Oedq,",Vigenère
BXSRMYCPILLIMXRMEBKLBOQZKMFKEKYQ,Playfair
"Aaleaehw i tnhes urc,ta eeIKn,scsAi tr g",Rail Fence
"I uzivsrlcuuc Ieipwsc, zriz ocpc W Gwvm,",Affine
"L vkrxog fxw rii wkh Qreohv iru wkhlu Odqgv,",Caesar
"Y cdeeht ykd epb ddu Delhuc vyn ddusn Pwdno,",Vigenère
SXFHMUCHZLHPKPCFANCSILPHDZCFKASMRYXA,Playfair
"Io    lftrn hudctofteNbe o hi ad,slufhosreLs",Rail Fence
"W uraelx sez ahh zrc Vanlcu hap zrcwp Livxu,",Affine
"Ghvluh klv Lhzhov, dqg wklv rwkhuv Krxvh,",Caesar
"Tuceho xso Mamohi, qxz ddyc eddubo Lkkca,",Vigenère
CKXSMKBFXSGULUXBRYPDSXRPCFATFHXLIU,Playfair
"Driesnhoro,eiehsIwl,adti tesHues  e  sh s",Rail Fence
"Xcuwpc rwu Wcoclu, ivx zrwu azrcpu Raeuc,",Affine
"Dqg pb pruh-kdxlqj, zrxog eh dv d Vdzfh",Caesar
"Qdn ci cynu-dqeedq, gkkvz la ko k Cksso",Vigenère
RACRCNNMFCMXGAQNMVTCCIBXBXNXEL,Playfair
"Amohnwd awn ymr-aig ol ea  acd eu,ubsSe",Rail Fence
"Ivx qy qapc-riewvm, oaelx nc iu i Uiosc",Affine
"Wr pdnh ph kxqjhu pruh, wkdw L vkrxog irujh",Caesar
"Je iqua wa rqdqah ieba, pxkp M irkkvz pkhqa",Vigenère
PROREFCLCVYQKMONMKPDRSSXFHMUHKNMIF,Playfair
"Tamurrt hdromk ehne oe htIsol og e gm,a ufe",Rail Fence
"Za qigc qc revmcp qapc, zriz W uraelx hapmc",Affine
"Txduuhov yqlxvw djdlqvw wkh Jrrg dqg Orbdoo,",Caesar
"Gkknhohi rdsqid qqwyxoj pxo Qykt wdn Vyuqvh,",Vigenère
LWRMMKPTWOEXTLNIBSAQSZPDFIAVRHRACTNHMSSU,Playfair
"Qr uantG  auresvis gis h odadLyl,alntateonol",Rail Fence
"Keippclu jvweuz imiwvuz zrc Maax ivx Layill,",Affine
Ghvwurblqj wkhp iru zhdowk,Caesar
Tucphyuyxc dduw vyn gaqvpx,Vigenère
CKTLMNBGYQPDLCPHNZIMPLBV,Playfair
Drnhfwtetoigte o elhsy mra,Rail Fence
Xcuzpaywvm zrcq hap ocilzr,Affine
Pdfg. Wklv Dxdulfh,Caesar
Cqmz. Jxso Eqqbeso,Vigenère
ORHCPDSXMXRMEBIU,Playfair
M.iucad hsAaiecT r,Rail Fence
Qisx. Zrwu Ieipwsc,Affine
vwlfnhv ghhshu: jurzhv zlwk pruh shuqlflrxv urrwh,Caesar
ojsyaoo nauzah: wbkmoo gejr cynu lubjymeeeo bkeda,Vigenère
TLEBEFTBIUFLKMKNNVILXGPDONMKLFMAEBFAXLMNRPIU,Playfair
skdegeim noretce epr rwswt oepriiu otise:o hrecso,Rail Fence
uzwsgcu xccfcp: mpaocu owzr qapc fcpvwswaeu paazc,Affine
Wkhq Vxpphu-vhhplqj Oxvw: dqg lw kdwk elq,Caesar
Jxoj Wqcwah-ouoiyxc Pqid: kjt ej dqdd led,Vigenère
PDGMLXAUCLATIULCGAEQXLSRRYKSBOPDISAW,Playfair
T msiL:d hnhnSme-emn ut n tht ieuregsaiab,Rail Fence
Zrcv Ueqqcp-uccqwvm Leuz: ivx wz rizr nwv,Affine
"Wkh Vzrug ri rxu vodlqh Nlqjv: bhw gr qrw ihduh,",Caesar
"Jxo Cgkhn ep een chqsju Ayxci: oop nk xkj buknu,",Vigenère
PDILVNDKHPMVATSMGAFEGAIQCGZKNARPGFRMIU,Playfair
"TSd  iKseotah wr forsan ig:ytd o er,eooulen  nfe",Rail Fence
"Zrc Uoapx ah aep uliwvc Gwvmu: ycz xa vaz hcipc,",Affine
"Vfrwodqg kdwk Irbvrqv, wr iloo ys brxu zloo",Caesar
"Isypbkjt dqdd Jkockdc, dk pebv lz oyqh syvh",Vigenère
LBRPSMRYBOPDPHBQNATLHPESPUQHMVNZESSU,Playfair
"Sl hysolpuictadht osn,t ilv orwlonaFo f y l",Rail Fence
"Usazlivx rizr Hayuavu, za hwll jf yaep owll",Affine
"Ri brxu phhuh Rzqh. Doo wkhvh duh sruwdeoh,",Caesar
"Ev ueen wauba Ssdo. Ehb pxoou who fynjkxbo,",Vigenère
HPHNZMCLKMFMNYIMSUPLCFLIRMFLNMSRCSIU,Playfair
"OomenAteerlfyu er we l hs r otbe reO.leapa,",Rail Fence
"Ah yaep qccpc Aovc. Ill zrcuc ipc fapzinlc,",Affine
Zlwk rwkhu Judfhv zhljk'g,Caesar
Mydd ypxon Knqmai suscx'z,Vigenère
XGPDRPCFNKMRELQXFKFYBZ,Playfair
W ersidihohrGae eg'tt cwh,Rail Fence
Owzr azrcp Mpiscu ocwmr'x,Affine
"Pdo. Exw L kdxh qrqh. Wkh Nlqj-ehfrplqj Judfhv,",Caesar
"Cqv. Fqj Y rwko dyju. Dra Oedq-royewedq Qbwsoo,",Vigenère
ORSCZLFBMXGMNAKLCFEKYQCIHMAEYQKNMBIL,Playfair
"M  an.eneiGea.BtIhu oe h igbcmn rcslu enTK-oga,",Rail Fence
"Qil. Nez W riec vavc. Zrc Gwvm-ncsaqwvm Mpiscu,",Affine
"Dv Lxvwlfh, Yhulwb, Whps'udqfh, Vwdeohqhvvh,",Caesar
"Qi Ykcpyma, Lubeji, Xacz'hkjso, Wpqlhuxaica,",Vigenère
BXEXTLEBFUKMKSDQLCTORAELTLBIULMGXALI,Playfair
"AucVtT'cSlssIsie eiy eprne tbees, t,r,ma,ane",Rail Fence
"Iu Weuzwsc, Jcpwzy, Zcqf'pivsc, Uzinlcvcuuc,",Affine
"Erxqwb, Shuvhxhudqfh, Phufb, Orzolqhvvh,",Caesar
"Reejji, Tahcakonqxyu, Wonsi, Pkmvedooio,",Vigenère
HAWMQDLFATLMKMRAELCLMDCQNVSEMGXALI,Playfair
"BtPea,r lsony esurne ec,Lwies,u,recMyone",Rail Fence
"Naevzy, Fcpucecpivsc, Qcpsy, Laolwvcuuc,",Affine
"Ghxrwlrq, Sdwlhqfh, Frxudjh, Iruwlwxgh,",Caesar
"Tuekjskd, Zkpyojso, Gkkbwwo, Jkhdejezu,",Vigenère
CKVMSKNASOSKGMELHMZMNIFGNMSKLZCK,Playfair
"Dt,tcCa tdeoin aine org,FriueuoPe,ueot,",Rail Fence
"Xceazwav, Fizwcvsc, Saepimc, Hapzwzexc,",Affine
"L kdxh qr uhoolvk ri wkhp, exw derxqg",Caesar
"Y rwko dy hohbsox kv pxoi, xkd qlkkxz",Vigenère
FBMXGMNMLUSEPBHPPDLCCXSRHAWMBZ,Playfair
"Iuolh mubd aen els fte,btaonh rioh  u",Rail Fence
"W riec va pcllwur ah zrcq, nez inaevx",Affine
"Lq wkh glxlvlrq ri hdfk vhxhudoo Fulph,",Caesar
"Yd pxo tsqyceex ep ukyx oueahkhb Shsiu,",Vigenère
GAPDKCEXSXFAANGFMBBPLMKMMSUEAKCL,Playfair
"Ihiioasr mnteduso fec eealCie  in hulr,",Rail Fence
"Wv zrc xwewuwav ah cisr ucecpill Spwqc,",Affine
"Dfwlqj lw pdqb zdbhv. Qdb, kdg L srzuh, L vkrxog",Caesar
"Qsdedq yd ckjo sqiai. Xku, dqn S legnu, S oxyqbn",Vigenère
MBSKYQKSORYGXNCGQANBBOBKVHZNFKPBMVTC,Playfair
"Antna.ya rIocigi aywys a,hdIpwe  hudt m eN  o,sl",Rail Fence
"Iszwvm wz qivy oiycu. Viy, rix W faopc, W uraelx",Affine
"Srxuh wkh vzhhw Plonh ri Frqfrug, lqwr Khoo,",Caesar
"Feenu pxo igaud Wshao ep Myjsynt, yxpe Xuvh,",Vigenère
VHZMKLCFQXIUKLAETEFMEHNAHMDKGAPRCFSUSU,Playfair
"PeeeMe c,teor h we ik fCnod noHl,utstloori l",Rail Fence
"Faepc zrc uoccz Qwlgc ah Savsapx, wvza Rcll,",Affine
"Ysuruh wkh yqlxhuvdoo shdfh, frqirxqg",Caesar
"Lfbkho jra fjyeahcwbv fowso, mkdpkkxz",Vigenère
OVMNMKPDFUAGMLATMSPQIMELHMOGMVRY,Playfair
"Vrhnrla fdpoeteviesl ec,cnonr  uapeou",Rail Fence
"Jfpapc zrc jvwecpuill fcisc, savhaevx",Affine
Doo yqlwb rq hduwk,Caesar
Qbv lxeji ex uknjr,Vigenère
MSPUAGQDNAIMDZBV,Playfair
Avy tl nt nerhlioa,Rail Fence
Ill jvwzy av cipzr,Affine
"Pdfg. R Vfrwodqg, Vfrwodqg",Caesar
"Cqmz. E Wyedhqxz, Isypbkjt",Vigenère
ORHCAPHMLPRABTHMLPRABZ,Playfair
"M.Sl,onad  ctad ctadcOonSl",Rail Fence
"Qisx. A Usazlivx, Usazlivx",Affine
"Pdo. Li vxfk d rqh eh ilw wr jrxhuqh, vshdnh:",Caesar
"Cqv. Mb cqsr q kdo ro vsp dk qkkondo, clukgu:",Vigenère
ORSEIPMEBONAICFGKSPRFNMLMAILLFRIIU,Playfair
"M s net e,e:a.I uhaoeb i ogure paelfc  ftonsk",Rail Fence
"Qil. Wh uesr i avc nc hwz za maecpvc, ufcigc:",Affine
L dp dv L kdxh vsrnhq,Caesar
Y ki ko M xkqu ofygux,Vigenère
SBORXSBOMLTQRFGM,Playfair
I Iupn ma  aesoeash k,Rail Fence
W iq iu W riec ufagcv,Affine
Pdf. Ilw wr jrxhuq? Qr qrw wr olxh. R Qdwlr[q] plvhudeoh!,Caesar
Cqm. Jej pe ceeahx? Rk xkj pe hyea. E Rwjsk[x] weionqlhu!,Vigenère
ORHEKSPRFNMLMAANANSZPRSEMLNARSFAAOSXKMBIUL,Playfair
M  grNoouOtnia!a.Ftt oen ontt ie  ai[]msrbeciou?  l.No el,Rail Fence
Qis. Hwz za maecpv? Va vaz za lwec. A Vizwa[v] qwucpinlc!,Affine
"Zlwk dq yqwlwohg Wbudqw, eorrgb Vfhswuhg,",Caesar
"Mydd kj fjjspboz Xuhkjj, rvkenu Wyuzphoz,",Vigenère
XGPDRAWOSKLPKCQDMRRQCSAVRHBQELQLMKBZ,Playfair
"W vt a oSt,iha nildTrn,bod cprdtnteytlyee",Rail Fence
"Owzr iv jvzwzlcx Zypivz, nlaaxy Uscfzpcx,",Affine
Zkhq vkdow wkrx vhh wkb zkrovrph gdbhv djdlqh?,Caesar
Mxoj cdqvp ddee ioa ddo sxyhiyiu zqiai wwkedo?,Vigenère
VYGMPBMSSZPDMVLIKLYBVYMPPACLBRCGXBINGAIU,Playfair
W lhstws egehnsatto e h hloedysaan?eh ueyoma i,Rail Fence
Orcv urilz zrae ucc zry oraluaqc xiycu imiwvc?,Affine
Vlqfh wkdw wkh wuxhvw Lvvxh ri wkb Wkurqh,Caesar
Iyxyu pxkp ddu pheaid Scoko ep jru Xdhyju,Vigenère
XSMYKLBOSZPDKLMZILSKXALXFMKPYBPDMNMG,Playfair
Seahrtsohheic httetus su ftyTrnnt  eIe  o,Rail Fence
Uwvsc zriz zrc zpecuz Wuuec ah zry Zrpavc,Affine
"Eb klv rzqh Lqwhuglfwlrq vwdqgv dffxvw,",Caesar
"Ro dyc egju Yddahnesdeex idwdno kyseoj,",Vigenère
DBBFPANYFKRQKMBKDLFAAQSRRYXBBUEMTL,Playfair
"BiwIrt nasyhson nedcinsad cut  etiotsc,",Rail Fence
"Ny rwu aovc Wvzcpxwszwav uzivxu isseuz,",Affine
Dqg gr'v eodvskhph klv euhhg? Wkb Urbdoo Idwkhu,Caesar
Qdn ty'i xbkofraco xso lnuoz? Jxi Byuqvh Jwjrah,Vigenère
RABZHRXISMTQCFCLBFXIMKKCPDDNNHMSPERSCFAZ,Playfair
Ad smir?yy hn osbapeehsbed h oalFted'lh  eTRlar,Rail Fence
Ivx xa'u nliufrcqc rwu npccx? Zry Payill Hizrcp,Affine
"Zdv d prvw Vdlqwhg-Nlqj: wkh Txhhqh wkdw eruh wkhh,",Caesar
"Mqc q iecp Wwyxpun-Usjw: jra Uquoju pxkp lkho jrau,",Vigenère
XNXBONTLXBGALKKTGAKQCFLWIUGMKLBOSDNMKLCFIU,Playfair
"Wasaei  et eea  otSitdKn:teQen htbr hesm n-ghueaot,",Rail Fence
"Oiu i qauz Uiwvzcx-Gwvm: zrc Keccvc zriz napc zrcc,",Affine
"Riwqhu ysrq khu nqhhv, wkhq rq khu ihhw,",Caesar
"Evdjub lzkd dub axauc, ddux ex xon paud,",Vigenère
HPQRKMOVNACFDTMGILPDGMNACFOKIUKL,Playfair
"Oephkshoeefnrvo e ne,te nhrfe,t nre n  t",Rail Fence
"Ahzvcp jfav rcp gvccu, zrcv av rcp hccz,",Affine
"Gb'gh hxhub gdb vkh olx'g. Iduh wkhh zhoo,",Caesar
"To'zu akono zqi ira vek'z. Vqba dduo mohb,",Vigenère
CBCKLMKMBCNBPBLUEXHKRMKLCFGULUSU,Playfair
"Deedsldat lyd ur a h i'.Fr hewl,'eyyeu eee",Rail Fence
"Xy'xc cecpy xiy urc lwe'x. Hipc zrcc ocll,",Affine
"Wkhvh Hxlov wkrx uhshdw'vw ysrq wkb vhoih,",Caesar
"Jxoou Ukshi pxyq bafowj'oj rfyj ddo ouvbu,",Vigenère
PDILIULMESTLFHZMFLIMLTPZVHRQYBLIPEIU,Playfair
"Teit esptsehs ul hurpa'tvo h ef,eEsoet nyl",Rail Fence
"Zrcuc Cewlu zrae pcfciz'uz jfav zry uclhc,",Affine
"Kdwk edqlvk'g ph iurp Vfrwodqg. R pb Euhvw,",Caesar
"Xqdd lwdsox'z wa pnew Cmkjvwdn. S ci Lbaid,",Vigenère
BOPDIBAGPBCRFGMNALHMLPRAHRNCDAILSZ,Playfair
"H id monO sahbns' efo ctad  yBettahmrSl.mr,",Rail Fence
"Rizr nivwur'x qc hpaq Usazlivx. A qy Npcuz,",Affine
Wkb krsh hqgv khhuh,Caesar
Jxi xylu adno rauba,Vigenère
PDBYHVIUGMBTCFKMIU,Playfair
Th seh oeed erypnhe,Rail Fence
Zry rafc cvxu rccpc,Affine
"Pdo. Pdfgxii, wklv Qreoh sdvvlrq",Caesar
"Cqv. Qwsnqvp, ddyc Xyxbo fkoiskd",Vigenère
ORUCMBCZIVKPBFQAAHULSOXAXSNA,Playfair
"M d,io sa.Mcuf hsNbepsinlaft lao",Rail Fence
"Qil. Qisxehh, zrwu Vanlc fiuuwav",Affine
"Fklogh ri lqwhjulwb, kdwk iurp pb vrxoh",Caesar
"Sxshto ep yxpuqnydu, dqdd pnew ci iyqbo",Vigenère
HYESCKHPGALKKNKSBYRSFPMNAUNCPAMUIU,Playfair
"Cdfti hoyuhleo nert,ht rmm oli igyaf se",Rail Fence
"Srwlxc ah wvzcmpwzy, rizr hpaq qy uaelc",Affine
"Zls'g wkh eodfnh Vfuxsohv, uhfrqflo'g pb wkrxjkwv",Caesar
"Myz't pxo rvwsua Wyhelboo, numkdmeb'z wu ddeecxdo",Vigenère
XGTHPDICSMDEILDMVLULTALENABETCNCPDMVFYLT,Playfair
"Wdea usecd usi' h lceSrpe,rcni' ytogtptbkcl olmhh",Rail Fence
"Owf'x zrc nlisgc Uspeflcu, pcsavswl'x qy zraemrzu",Affine
"Wr wkb jrrg Wuxwk, dqg Krqru. Glxhoolvk Pdfehwk,",Caesar
"Je pxi wykt Jhepx, qxz Lkdyn. Tyeabveir Wkyropx,",Vigenère
PRPDGQAVRHZDZLBORYFHANDKEXLUSEPBORHDKLBV,Playfair
"ThoThno.uiMeotygo rt,adHnr iels abt,  du  oDlhch",Rail Fence
"Za zry maax Zpezr, ivx Ravap. Xwecllwur Qisnczr,",Affine
"Eb pdqb ri wkhvh wudlqhv, kdwk vrxjkw wr zlq ph",Caesar
"Ro iqxu yb dduca dnqsjuc, rwjr iyqwrp dk ged iu",Vigenère
DBORYGHPPDILKLMRGAILBOPDPAWEDPPRXGAOIU,Playfair
"Baoh i,tot  ymn fteetans ahsuh ownm y sreh gtie",Rail Fence
"Ny qivy ah zrcuc zpiwvcu, rizr uaemrz za owv qc",Affine
Lqwr klv srzhu: dqg prghvw Zlvhgrph soxfnhv ph,Caesar
Yddk rei legah: qxz wktooj Mycatyiu lbeyaoo wa,Vigenère
GAPRBFTQNVKMRACRRHILQZSXKCNOFLUMDEILCL,Playfair
I  eamsiopkmnohspwr n oetWsdm lce etio:dd eeus,Rail Fence
Wvza rwu faocp: ivx qaxcuz Owucxaqc flesgcu qc,Affine
Iurp rxhu-fuhgxorxv kdvw: exw Jrg derxh,Caesar
Vhyi yqub-sbateheeo rwid: lqj Wen qlkko,Vigenère
KONOMVKMDMKCMUMVPBBXSDZLFNBRHAML,Playfair
F reoh:tdormoe-rdlu at u o buoucussbGae,Rail Fence
Hpaq aecp-spcxelaeu riuz: nez Max inaec,Affine
Ghdoh ehwzhhqh wkhh dqg ph; Iru hxhq qrz,Caesar
Tukhu xudsuoju pxoa kjt iu; Pyn oqux dys,Vigenère
CKMSICKLUGGMKLCFIMRYCLPHMKMLAWANXZ,Playfair
DetnhamFe el eweete n e o unnwabe ed;reo,Rail Fence
Xcilc nczoccvc zrcc ivx qc; Hap cecv vao,Affine
"L sxw pb vhoih wr wkb Gluhfwlrq, dqg",Caesar
"Y zqj io ouvbu pe pxi Nsnumpyyj, wdn",Vigenère
FSZLNCLIPEKLRPYBBKMKDLFAARRY,Playfair
"It foyri  u yslet h ieto,adpme tDcnn",Rail Fence
"W fez qy uclhc za zry Xwpcszwav, ivx",Affine
Yqvshdnh plqh rzqh ghwudfwlrq. Khhuh delxuh,Caesar
Ldclukgu iyxa ysdo tophkyjskd. Roaho qlekba,Vigenère
WOTQIMEFAEMGNVMGCKZDMBSKNACFKMIMISZMIU,Playfair
Ve enecne unpaemn wedtato.Heeairskio ri rbe,Rail Fence
Jvufcigc qwvc aovc xczpiszwav. Rccpc inwepc,Affine
"Wkh wdlqwv, dqg eodphv L odlgh ysrq pb vhoih,",Caesar
"Jxo jkeddo, wdn rvwcoo M bketo lzkd io ouvbu,",Vigenère
PDKLBSRQXBRYCSROILESBSCKOVNANCLIPEIU,Playfair
"Tttabe dpme,h ans n lmsIlievo ysleei,da a n f",Rail Fence
"Zrc ziwvzu, ivx nliqcu W liwxc jfav qy uclhc,",Affine
Iru vwudqjhuv wr pb Qdwxuh. L dp bhw,Caesar
Veb idnqxcubo dk wu Rwjenu. S wc uud,Vigenère
PHATZDRAIFATPRNCARLZMKSBNCKL,Playfair
Fsns NrI o tagr om aue  mytrretyt.ae,Rail Fence
Hap uzpivmcpu za qy Vizepc. W iq ycz,Affine
"Yqnqrzqh wr Zrpdq, qhxhu zdv iruvzruqh,",Caesar
"Ldujegju pe Mewwd, doqub mko pkhcsebju,",Vigenère
WOGRNVMGPRVNORAWMGMLNZBXPHATVNMAIU,Playfair
"Vo Wne  snnnwet oa,nurwsfrwreknom eaoo,",Rail Fence
"Jvgvaovc za Oaqiv, vcecp oiu hapuoapvc,",Affine
Vfduvhob kdxh frxhwhg zkdw zdv plqh rzqh.,Caesar
Isknioho dqea mkkopun mrwj sqc csju kmxa.,Vigenère
LBRMLIQCBOMLHMMLLKYZBOQZBXAEMGNVMG,Playfair
Ss eudaaio.creyhu oee htwsmn wealactw  en,Rail Fence
Usipucly riec saeczcx oriz oiu qwvc aovc.,Affine
"Dw qr wlph eurnh pb Idlwk, zrxog qrw ehwudb",Caesar
"Qj je pywa lneua wu Jwydd, seeht jed rophku",Vigenère
RSANSKCLDARFLCHGBSPDVNMUYRRPCIZDNB,Playfair
"Aomr Fho  rtn ieboem at,wudntbta t kyi loey",Rail Fence
"Iz va zwqc npagc qy Hiwzr, oaelx vaz nczpiy",Affine
"Wkh Ghxloo wr klv Ihoorz, dqg gholjkw",Caesar
"Jxo Noqyvh dk rei Vuvheg, kjt zuvewrp",Vigenère
PDKCLMESPLHFSXGFSUPMXNRYCKSEFYSZ,Playfair
"TDlosl,dlth eilt i elw n eiheu hFoadg",Rail Fence
"Zrc Xcewll za rwu Hcllao, ivx xclwmrz",Affine
Qr ohvvh lq wuxwk wkhq olih. Pb iluvw idovh vshdnlqj,Caesar
De hucou ed phepx pxoj vevo. Qu pehcp pwbca clukgyxc,Vigenère
ANULXALIGAZDZLDPCFMQKGLCHGKATLIOPTILLFRIGAIW,Playfair
Ne thei ftlskolsei rt hnlf.M is as paig snut eyrfeen,Rail Fence
Va lcuuc wv zpezr zrcv lwhc. Qy hwpuz hiluc ufcigwvm,Affine
Zdv wklv ysrq pb vhoih. Zkdw L dp wuxob,Caesar
Mqc jrei rfyj wu cabpa. Mxkp M qw jbqbi,Vigenère
XNTLBFPXVHAOBQLUGFVYRSSBRLMZQC,Playfair
Wt n fW mua hsvo ysle htIa rlsipme.a ty,Rail Fence
Oiu zrwu jfav qy uclhc. Oriz W iq zpely,Affine
"Lv wklqh, dqg pb srruh Frxqwulhv wr frppdqg:",Caesar
"Yi pxsju, qxz wu zkeba Gkkxphsai pe yewiqxz:",Vigenère
SXPDGAIMRYNCVHNMLEMVRQAKILPRHMAUORRY,Playfair
"Ih,d ror castie n ypoeCutist omn: namo neomd",Rail Fence
"Wu zrwvc, ivx qy faapc Saevzpwcu za saqqivx:",Affine
"Zklwkhu lqghhg, ehiruh wkhb khhuh dssurdfk",Caesar
"Mxspxon sjtoat, robeba ddui xoaho qzlhywsr",Vigenère
VYKSCFAKRYIUKCCIPHMKPDGCCFKMIMSVTONRHY,Playfair
"Whiebrhhepchte ned eoete er prahird,f yeao",Rail Fence
"Orwzrcp wvxccx, nchapc zrcy rccpc iffpaisr",Affine
Rog Vhbzdug zlwk whq wkrxvdqg zduolnh phq,Caesar
Ebn Coumknt sydd dad pxyqikjt sqbhyua wad,Vigenère
MPBTGCXNDKXGPDLKRQFHXLRAYZRMSEEFCLAW,Playfair
OSaw  udrenl ewr ihtntosn alk edydtehawim,Rail Fence
Alx Ucyoipx owzr zcv zraeuivx oiplwgc qcv,Affine
"Douhdgb dw d srlqw, zdv vhwwlqj irruwk:",Caesar
"Qbbaqnu kp k fyedd, gwi oudpyxc pkebpx:",Vigenère
MSMKRBBNSRVHGAQZBXLISZSKYQPHNMPD,Playfair
"Aaa nwsiftled tapit a etn orhry o,stgo:",Rail Fence
"Ilpcixy iz i fawvz, oiu uczzwvm haapzr:",Affine
"Qrz zhh'o wrjhwkhu, dqg wkh fkdqfh ri jrrgqhvvh",Caesar
"Deg moa'v jycuddub, kjt pxo srwdma yb qkenjucou",Vigenère
ANXZUGLUPRIFPDKMRAKZCFHYRAELHPFNRHMGXALI,Playfair
"Nwlgeatccfoso e' oehr n h hneo odeswett,dea gne",Rail Fence
"Vao occ'l zamczrcp, ivx zrc srivsc ah maaxvcuuc",Affine
Eh olnh rxu zduudqwhg Txduuhoo. Zkb duh brx vlohqw?,Caesar
Ru hyua yqh sqbnqxpun Aewhbabv. Ado who oyq cebojj?,Vigenère
CISEEFMVNZRMMRRQKCLWRMMKSUQUYBRMGCMVXSULRQ,Playfair
BiowadalWaysnelk u arne urel h r o iet errtQr.yeul?,Rail Fence
Nc lwgc aep oippivzcx Keippcll. Ory ipc yae uwlcvz?,Affine
"Pdfg. Vxfk zhofrph, dqg yqzhofrp wklqjv dw rqfh",Caesar
"Cqmz. Ikmd gabmkco, kjt rdgabmkc pxsjwc qd exyu",Vigenère
ORHCLXHYUGUENOIMRYWOUGUENOPDGAIQRSNAEL,Playfair
"M.cemavl nanad uhwloe n necmtig toccS c,dwohs e",Rail Fence
"Qisx. Uesr oclsaqc, ivx jvoclsaq zrwvmu iz avsc",Affine
'Wlv kdug wr uhfrqfloh.,Caesar
'Dso rwhn jy hoyexyyva.,Vigenère
SKPBRMKZNMLENABEUL,Playfair
' d olTshr orcnieiatec.,Rail Fence
'Zwu ripx za pcsavswlc.,Affine
Hqwhu d Grfwru.,Caesar
Uddah w Hksdkh.,Vigenère
GMLKMRHRDLNM,Playfair
ErDone  otrtac.,Rail Fence
Cvzcp i Xaszap.,Affine
"Pdo. Zhoo, pruh dqrq. Frphv wkh Nlqj iruwk",Caesar
"Cqv. Aabv, wkho qxkd. Myiuc jra Oedq vynjr",Vigenère
ORQULUUCNMIMANMYNOILPDFEGAIGNMPD,Playfair
"M loa.mtK ta.Wl,mr nn oe h igfrhle eoCseno",Rail Fence
"Qil. Ocll, qapc ivav. Saqcu zrc Gwvm hapzr",Affine
L sudb brx?,Caesar
Y znqi oyq?,Vigenère
FSMRBWHNVZ,Playfair
Iao ryyup ?,Rail Fence
W fpiy yae?,Affine
Grfw. L Vlu: wkhuh duh d fuhz ri zuhwfkhg Vrxohv,Caesar
Temp. Y Weh: jraho qba k sbam kv shopsrat Ieehuc,Vigenère
HRDLSXKAPDKMIMMKMBMKVNGVMKLDCFBTMVULXA,Playfair
D.S rr w tduot  i:teeaeace fwece olscIrh  rorhSe,Rail Fence
Xasz. W Uwp: zrcpc ipc i spco ah opczsrcx Uaelcu,Affine
Wkdw vwdb klv Fxuh: wkhlu pdodgb frqxlqfhv,Caesar
Jxkp cpqi xso Gqho: ddusn wwbkzo yexqyxyuc,Vigenère
PDRSTLNBBFLBZMKLCFKAORSMCBHMMWGAELXA,Playfair
T ysrtrl uehtsa i ue hi aaycnicsathC:emdon,Rail Fence
Zriz uziy rwu Sepc: zrcwp qilixy savewvscu,Affine
"Wkh juhdw dvvdb ri Duw. Exw dw klv wrxfk,",Caesar
"Jxo wbaqd qcoqi ep Kbp. Rkd qd xso dkkmd,",Vigenère
PDFIMKRSBXXBHNIODZCXSRPDSXPRMEBV,Playfair
"TgtsorBaio,h ra sa fAt u thstuheeay .t  c",Rail Fence
"Zrc mpciz iuuiy ah Ipz. Nez iz rwu zaesr,",Affine
"Vxfk vdqfwlwb kdwk Khdxhq jlxhq klv kdqg,",Caesar
"Ikmd cwdmpydu rwjr Rowkoj qekoj rei dqxz,",Vigenère
LXHYXBMYSKQDBOPDCFMXGMIKMLOYSXBORY,Playfair
"S cytenuhh,uhsntt ahHae ie i adcaih ugnsn",Rail Fence
"Uesr uivszwzy rizr Rciecv mwecv rwu rivx,",Affine
Wkhb suhvhqwob dphqg.,Caesar
Jxou znucaddho wcojt.,Vigenère
PDGCTOILGMLPBNCLRY,Playfair
T slm.hypeetyaedern n,Rail Fence
Zrcy fpcucvzly iqcvx.,Affine
Hqwhu.,Caesar
Uddah.,Vigenère
GMLKAZ,Playfair
Erne.t,Rail Fence
Cvzcp.,Affine
Pdo. L wkdqnh brx Grfwru,Caesar
Cqv. M jrwdua ikk Tempeb,Vigenère
ORSEPDRAEFHNZCMHPRAZ,Playfair
M heuca.Itak o otrl nyDo,Rail Fence
Qil. W zrivgc yae Xaszap,Affine
Pdfg. Zkdw'v wkh Glvhdvh kh phdqhv?,Caesar
Cqmz. Mxkp'c jra Heiowio xo cowdoo?,Vigenère
ORHCVYRSTLCFBKLIBXFCLCIMMGXA,Playfair
M.a  e mead htsteDsaeh enscW'hisea?,Rail Fence
Qisx. Oriz'u zrc Xwuciuc rc qcivcu?,Affine
Pdo. Wlv fdoo'g wkh Hxloo.,Caesar
Cqv. Xei yqvh'n jra Iqyvh.,Vigenère
ORPLSXBMSUTCPDIULMESSU,Playfair
M  ltEla.Tscl' h ul.liadei,Rail Fence
Qil. Zwu sill'x zrc Cewll.,Affine
"D prvw pbudfxorxv zrunh lq wklv jrrg Nlqj,",Caesar
"Q wkid cinqmqbyqi sebgu ed pxso qken Usjw,",Vigenère
ROAPLRDNMBMUMVQXNMEFGAPDSXFNRHEKYQ,Playfair
"Asyusrihg g otmrclu ok nti odKn,m aowe soi",Rail Fence
"I qauz qypiselaeu oapgc wv zrwu maax Gwvm,",Affine
"Zklfk riwhq vlqfh pb khhuh uhpdlqh lq Hqjodqg,",Caesar
"Mxsyx kvdad oyxyu io duonu nuwwyxa sj Ijwvwdn,",Vigenère
VYEBFHKPGMXSMYLCBYIUKMKMLCBSMGGAGMEQRABZ,Playfair
"Whtse renngdhc fe ic yheermiei nln,ionnme a Ea",Rail Fence
"Orwsr ahzcv uwvsc qy rccpc pcqiwvc wv Cvmlivx,",Affine
L kdxh vhhqh klp gr: Krz kh vrolflwhv khdxhq,Caesar
Y rwko ioado xsi nk: Xeg xo iyhymejoo raqead,Vigenère
FBMXILIUGMFCEAHRFHVYILMPEBKSILCFMXGM,Playfair
Iue    scsa aeseehmd:Hwh oiie eunh niooelthe,Rail Fence
W riec uccvc rwq xa: Rao rc ualwswzcu rciecv,Affine
Klpvhoih ehvw nqrzhv: exw vwudqjhob ylvlwhg shrsoh,Caesar
Xywouvbu xucp ujegai: rep cphkjwoho rycejoz zaezhu,Vigenère
BFALLUGFCITLGRNVILCXLTZDRAIFQCXFXSLKHTFMQPIU,Playfair
He to:trevtplislebs nws u tagl iie epemfekebsnysdo,Rail Fence
Rwquclhc ncuz gvaocu: nez uzpivmcly jwuwzcx fcaflc,Affine
"Doo vzroqh dqg Yofhurxv, slwwlixoo wr wkh hbh,",Caesar
"Qbv igkbxa kjt Lbmahyqi, fspjsbkvh dk ddu aoo,",Vigenère
MSPTVNQMIMRYUPELMNXLSFSZSKEVSUPLRPCFGCIU,Playfair
"Asnnlo tloeel wleadVcru,ptiult h y,lo  esif te",Rail Fence
"Ill uoalvc ivx Jlscpaeu, fwzzwhell za zrc cyc,",Affine
"Wkh phhuh glvsdluh ri Vxujhub, kh fxuhv,",Caesar
"Jxo coaho tsofkeho ep Cenwono, xo senuc,",Vigenère
PDLCIUKMKCSXSOKAFMIPZMIFNDCFEMMKXA,Playfair
